,Topic Title,Category,Tags,Leading Post,Post Replies,Created,URL
21,Paid looking for a manga artist for slice of life genre,Collaborations,[],"Please note this is Paid 
I am Looking for a Manga Artist for Slice of Life genre mixed with other genres to be exact : Slice of life, drama. supernaturalStory will be short 10-12 page comic/manga. 

Style for me is preferable if it's similar to Shigatsu wa Kimi no Uso (Your Lie in April) this is only a plus.
i am open to any art style you believe works for a slice of life story that you as an artist may have.
Also   please no bl/gl  / simply not interested in that  sorry..... 

Oh just a summary on the story A woman loses a special one to her, she gets reunited with them later on. they spent geniune special time ""special love not romance ahem! + they spent entertaining time together"" after the reunion is over. the loved one is gone and a change of heart happens ""overcoming grieve"" and moving forward in their life .

Payment is open for discussion i would like to take this on DM pleasePlease comment and leave references if your style is similar to Slice of Life genre and it would fit that.","['Portfolio: https://Kawaideska.deviantart.com23Message me if you need me thanks', 'Well, this is my style, dm in instagram (ma.se.ba) if you like enough.\nScreenshot_2021-06-26-02-41-47-1.png540x715 148 KB\n\nScreenshot_2021-06-25-19-31-36.png720x1280 572 KB\n\nScreenshot_2021-06-25-19-32-09-1.png540x729 298 KB\n\nScreenshot_2021-06-26-11-11-01-1.png711x894 809 KB\n', ""here's is my work on ig https://www.instagram.com/vsrstuff/16 if you like my work feel free to dm or pm me ^-^"", 'I can work in any style and genre. Here is a gallery with samples of my work: https://imgur.com/a/zt7keLU9 and color: https://imgur.com/a/potasg12Here are two chapters of manga I did in the past: https://imgur.com/a/8w9kyWe3 and https://imgur.com/a/Ayn4B743', 'Portfolio desu: https://www.instagram.com/son.zhon7/5Sample\n440f8bc0c3e5f23c860795f5f8d7e091.0.jpg960x1469 219 KB\n\na75a6a114969e0e6ba07eaac04140ed2.0.jpg960x1469 244 KB\n', ""Hello there I'm interested. \nHere is a price list for every 40 panels and it's divided in three styles, however I would believe that if you want a manga (Black & white with halftone) style would be right in between ($150)\nRed comis 3.png1232x799 974 KB\n...Here are as well some other examples\nRomani - Halftone - S.png680x833 354 KB\n\nBabysitting - S.png850x850 390 KB\n\nVampiresa - S.png680x833 448 KB\n\nLadyRose and Pochi - S.png680x833 734 KB\n\nCallis.png720x900 625 KB\n"", 'Interested to work on this:If you like my stuff/ think It something you could use please feel free to DM me or reach me on Discord:GoblinQueen#0768\n\n\nartstation.com2\n\n\n\nSoulless\nFreelance Goblin, looking for comic or illustrative work.\n\n\n\n\n\n', ""Hi. I don't know if you still want to find someone, but if you like my style in my comic (link bellow), then I would be happy to help \n\n\ntapas.io3\n\n\n\nZ as Zero | Tapas\nA few children are born with superpowers. These kids go to special classrooms, called The Z-class. One day the whole class wakes up in an arena-like place and they have to play a survival game. The person who loses there, dies in the real world....\n\n\n\n\n\n"", ""Hello! I'm interested. You can see examples of my art here:https://www.instagram.com/tamapochi_art/4"", 'Hi, I am interested too. I actually have a slice of life comic myself, which you can view here: https://tapas.io/episode/22386792\nMore examples of my comics are here:https://www.deviantart.com/sushy00/gallery/35187145/comics\nPlease send me a message or e-mail me at sushychan(at)gmail.com if you want to work with me.', ""This sounds interesting! Here's a few examples of my work:\n3.jpg1889x1417 853 KB\n\n5.jpg2362x1772 845 KB\n\nCoverweb2.jpg768x1152 723 KB\n\nYou can find more examples at my portfolio: https://www.artofemmalouise.com/artwork1\nFeel free to contact me here or at cosmosbadger@gmail.com\nThanks!"", 'https://drive.google.com/drive/u/0/mobile/folders/1g1bTaFampi55QD_S-Z9qgZ2xkOFwzUvI?usp=sharing_erp_m&userstoinvite=nachiketn.89@gmail.com&ts=60c94b7f&actionButton=14\nThis is my work! Message me if you’re interested, thx.', 'I can work any style and genre: https://imgur.com/a/zt7keLU7', ""Hello, i'm interested to work with you my portfolio: https://www.artstation.com/mito15"", ""Hi there, if you're still looking feel free to check out my illustrations at  https://afuji.orgMy comics are below if you'd like to see manga and 4panel comic samples.\n\n\ntapas.io2\n\n\n\nBe_Mine | Tapas\nAfter having a bad day, Kotomi goes home only to find a big surprise sleeping in her bed! A romance comedy that will hopefully be finished one day.\n\n\n\n\n\n\n\ntapas.io\n\n\n\nEasy Breezy | Tapas\nLittle comics about my little life.\n\n\n\n\n\n"", ""hello\nim interested if your still looking for artist here's my gallery:https://www.deviantart.com/doumasomi/gallery\nhope you like it thanks""]",6/26/2021 0:12,https://forums.tapas.io/t/paid-looking-for-a-manga-artist-for-slice-of-life-genre/60749
22,Back to School Collab and promo!,Collaborations,[],"Hi Everyone!
Here in the US, we're entering back to school season! For a little back to school special, I'll be making a collection of characters doing school-related activities. If you're interested, all you'll need to do is send me an illustration of your character doing a school-related activity. They can be playing an extra-curricular activity sport, studying in the library, having lunch in the cafeteria, chatting with friends before class, or anything school-related. They can even be the teacher(s) themselves! 
Please send an email to littletanidreamprince@gmail.com with a PNG file of your work and provide me your Tapas username, the title of your series, and a link to it so I can put it in the description. Feel free to leave your watermarks in the piece. I will email you back the complete collection so you can optionally post it to your series as well. 
Please have all works submitted by August 15th. If you have any questions please let me know! 
The complete collab collage will be posted by August 25th on my series here: https://tapas.io/series/Tanidreams/info17
Subbing to my series is not at all a requirement (but is absolutely appreciated), it's just so you know where to find the collab  
Have fun and good luck to everyone getting back to school! I'm one of them haha!","['This is so fun Is teacher is okay?Can I send to you?', 'Yes of course! Anything school-related! And yes you just send to me using the email address in the post ', ""This seems fun. I'm in!Also one question, can it be a little comic strip. And can we submit more than one drawing?"", ""I've mailed you Check it out, hope that is okay "", ""Awesome! And sure a comic strip is fine! And sure I don't mind you submitting more than one, but for now keep it at most 3 pieces. Thanks for joining!"", ""Can my characters be featured in it? If so, then I'm in!"", 'Yes of course  As long as they do something school related in your piece', 'I’d love to do this! But my comic is being posted on its own website rather than Tapas . Can I still participate?', ""Sure that's no problem! I just need your username so I can credit you "", 'This sounds really fun!I am defiantly interested in participating . What is the max or min size of the image you would like?', ""Hi! I would say to stay on the safe side, keep it at most 6.625 x 10.25 inch. Tapas puts a limit at 10MB and a width of 940px. I don't mind cropping it for you, though. I would say min size, keep it to where the image will still be visible within a 6.625 x 10.25 inch page. like don't do 300X300 pixels (way too small)."", 'Thank you! Looking forward to working on this ', ""Okay. I've just sent you the email of what I worked one. I hope you like it. "", 'I got it thank you so much!']",7/30/2021 20:44,https://forums.tapas.io/t/back-to-school-collab-and-promo/62346
23,Sub 4 Sub and Art Ideas,Collaborations,[],"Hello! Anybody can sub 4 sub with each other here and I will give you some art ideas as well!IDEAS:1. A dragon perhaps?2. Try drawing somebody else’s OC with permission!3. An evil 🥦 4. Some concept art of your character5. Doodle!
Oh, and also here is my book: https://m.tapas.io/series/The-4-Monarchs-/info3","[""We already subbed each other If any case, I'll sub who'll sub mine  Could you tell me about them? \n\ntapas.io1\n\n\n\nIt's lovely to see you  | Tapas\nWhere love is infinite, feelings are hidden, then eyes tell everything. And It's lovely to see! \n\nAra is a day dreamer, who dreams a guy alot.. She thinks that nick who is newly transferred to school is her dream boy but he loves someone else and...\n\n\n\n\n\n"", 'Who should I tell you about?', 'You mean, what should you tell me about ?', 'Yeah, that’s what I meant', ""About doodle and concept art If you don't want to tell in this thread, you can Dm me ""]",8/11/2021 11:11,https://forums.tapas.io/t/sub-4-sub-and-art-ideas/62838
24,"[Paid, Pro] Any Manhwa artist looking for some side work? [long-term webtoon, lewd, Isekai, fantasy, harem, romance, RPG, and action]",Collaborations,[],"IntroHello everyone, hope you're having a chill day, I'm searching for an experienced Korean Manhwa/webtoon artist to adapt/convert my light novel series into manhwa form, that is, bring it to life. I'm an established author, my series being the Anime Trope System. My series can be found on Amazon https://www.amazon.com/gp/product/B07KY4JDLZ?ref_=dbs_dp_rwt_sb_tkin&binding=kindle_edition42
Also can be found here: https://twitter.com/Alvin_Atwater27 and facebook.com/syr456
The goal is for a long term project and something me, the fans, and the artist can be proud of. Plans are to publish on Tapas and Webtoon. Now, I worked with a webtoon artist before and they charged me a rate of 20 per panel (which is 80 per page), but I'm willing to adjust this reasonably. Hell, if the artist of Solo Leveling were to show up, I'd be all about that haha.
Paid: Yep. [Paid per page though.]Budget: $1,000 a month for starts, but demand will increase as the fans settle in or people experience ATS for the first time through the webtoon: enabling the platform's revenue opportunities. [although I'm going to live with the expectation of paying out of pocket and nothing else, as well as keeping things realistic.] 
[if you're looking to get paid per episode, let me know asap and we can talk about it. If we're going to be working on this thing for years, I'd like that detail up and out of the way haha]
 I can only work with someone who knows how to make a good webtoon. I've already tried working with a n00b before and it was a complete disaster. I can't afford to be kind. Chill, yes. But everyone's responsible for their own creative careers.
Contact:twitter, reddit (syr456), or here is fine. I will invite the selectee to our discord server later. I know through dm's, I can only reply to those that we're interested in. While most artists simply leave their portfolio and bounce, I won't reply if the style isn't what we're looking for nor if the artist has no actual webtoon experience. Portfolios as usual, as they speak for you. [existing webtoons work too if the style is relevant.]
Schedule: ideally weekly or bi-weekly; however I've been in this game long enough to know that sometimes that shit isn't possible. However, I'm aiming for being productive. Just without burning out the artist: quality is important for a strong impression and to keep people coming back every week.  
Style:  This is non-negotiable. I've got the fan base, feverishly looking forward to ATS's webtoon. An experienced webtoon artist knows he's got to impress. Anime and manhwa art style only. High quality kind that is. Think about it. What brings you back to a Korean manhwa or doujin. 
Note: You must be fine with NSFW (though the nsfw bits will not be posted on Webtoon due to their TOS.) You don't have to worry about coming up with character designs. As an established series, we've got some to work with (though the art for some are still WIP from the main artist who does my book covers and characters.)
Note 2: we're directly adapting the book to manhwa/webtoon. While I have two old examples you can look at (which I challenge you to beat), I will be giving you the ebook. It's written in a way that is easy to convert. 
We of course have to take it one episode at a time haha. Let me know your max pages per week that you can do without losing quality or burning out. (Or max pages per bi-weekly, monthly, etc.) Although if you're not motivated and don't see yourself as being a part of the ATS brand in the future, it's probably best not to apply. Creative artists tend to quit on their own when they're not serious about something. 
I'll also accept references to awesome webtoon artists accepting jobs xD.","['\nthumbanail 2.jpg1080x1080 817 KB\n\nkou.jpg929x1204 778 KB\n\nchibi.png1199x1333 683 KB\nI have pase experience with comics, I make ONLY ANIME AND MANGA/MANHWA ART This would be a perfect project!', 'ill do it for free or $5 a 800x1280 page', '\n\nsyr456:\nsyr456\nI can also do a true beauty, or any style you request', ""Sounds interesting! I'm currently collab with a friend (a writer) and just getting started. And I was also about to start a lewd GL mixed with sci-fi action though I saw your post and looked at your link, and hey, that's kind of like my art style! I will try to reach you soon "", 'I did reverse search image and found this: https://twitter.com/iamdeadbird/status/1143211506185773056?s=1938Hmm the background looks very similar to your drawings...', 'its a commercial background is CSP,', 'Aight okay(Hi 20 chara)', ""Here's some examples of my art:https://www.instagram.com/tamapochi_art/8The only webtoon I've published publicly (I was trying to go for a cute, pencil-like style on this, I'd say my artstyle is pretty flexible though) :\n\ntapas.io11\n\n\n\n7th Street (hiatus :3) | Tapas\nhttps://www.deviantart.com/tamapochi\nhttps://www.instagram.com/tamapochi_art/\n\nA group of children are suddenly sent to 7th Street's mysterious manor. Lennon, Brenda, Kennedy, Arran, Millie, Cressida, and Callum don't know what awaits them; all...\n\n\n\n\n\n"", 'Hi! Just sent you a DM of my portfolio, thanks!', 'Hi, I am interested too. You can view examples of my work here: https://www.deviantart.com/sushy00/gallery/35187145/comics13\nI can complete 1-2 pages per week depending on the complexity. I have no problem drawing NSFW artwork.Please send me a message or e-mail me at sushychan(at)gmail.com if you want to work with me.', ""Hopefully by next week, I'll find someone suitable for the Anime Trope System. I'm not settling for less this time around, xDBut I'm also not expecting the next God of Art. Just want to create something competitive that will keep my fans coming back. (ATS is an established LN series with 21 books in it.)We have to make an impression. A long-term business associate is just a bonus on the side. Ah, should probably emphasis that with this being an adult series, you must be 21 years or older to apply.  It would be quite weird otherwise, questionable at that. [Though I'm expecting the experienced artists to be older to be fair.]One of my peers who wrote  The Beginning After the End is way ahead of me in the webtoon space.Hell, ATS won't even be the only one I'm starting up. Just a step into the space. \nThe old art/toon that you see on Tapas and Webtoon right now will be taken and replaced with the person commissioned."", ""I just made this drawing based on the character on your cover, a combination of anime and manhwa, this is purely my art style. I'm sure this kind of art you are looking for \nchar2a_.jpg800x987 115 KB\n"", ""Hi!  this seem really interesting!I'm a comic colorist working on various titles. If you are in need of a digital colorist, i am available for long-term work! Here's a link to my portfolio.13 Do contact me if you need more examples!Email: jayesumire(at)gmail.comDiscord: Jaye#0214\nThank you for your time!"", ""By the way, here are examples of what we're looking for:A. Nsfw twitter warning.  Webtoon example 125 <--probably one of the best. B. Solo Leveling14C.   Release that Witch, Nano Machine,  Immortal Swordsman in the Reverse World, so on. \nYour pay definitely increases from a mere 1k a month if it keeps people coming back, devouring it, waiting more.Simply put: I don't want to fund a webtoon that I won't like. Hell, I want to look forward to it as well \nStatus: still looking through portfolios. (if you don't have a portfolio posted, you will not be considered. It's only fair to myself, the fans, and others.) Giving this until next week, maybe Friday before calling it quits. \nI may start to buy 1 page from those with potential just as a test. (But of course after making sure they're legit xD. I don't understand scammers either man.)"", ""The cover has updated, though my character would look closer to Jin-Woo from Solo leveling than what the artists so far have conjured. I never gotten around to correcting that, as most of the art focus are on the waifus haha.Edit: don't forget the link to the portfolio. That and social media to check and make sure people are legit."", 'Hi! I sent a message, I wonder if you check personal message or should I post here?', ""I actually read through some of your work. I'm determining if the style works for a series that can have some intense action and transformation scenes. Not to mention ATS's lewd scenes. Honestly, I'll have to adjust the pay, perhaps increase it whenever the complexity of the scenes increase. \nI do like the colors and work you've done with each scene. Backgrounds help people experience the world the characters are living in. \nNot bad though. That second one was enough to tug on the heart strings. And I'm quite sad for his mother D:\nI nearly dismissed this outright at first because I thought the first one was BL, which is something I don't read haha."", 'Cool, thanks! If you find my style suitable or you need a BG artist, you can message me anytime.', ""status: not found yet. But being a little picky now could end up with something I'd take pride in later.""]",8/5/2021 19:47,https://forums.tapas.io/t/paid-pro-any-manhwa-artist-looking-for-some-side-work-long-term-webtoon-lewd-isekai-fantasy-harem-romance-rpg-and-action/62598
25,Unpaid Collaboration - looking for an ARTIST PARTNER,Collaborations,[],"
Captură de ecran din 2021-08-11 la 00.38.03.png308x765 38.4 KB

Captură de ecran din 2021-08-11 la 00.39.24.png298x761 32.7 KB

Captură de ecran din 2021-08-11 la 00.37.46.png299x753 53.9 KB

Captură de ecran din 2021-08-11 la 00.38.37.png297x756 42.1 KB

Captură de ecran din 2021-08-11 la 00.40.25.png298x757 46.7 KB

Captură de ecran din 2021-08-11 la 00.38.56.png300x753 43 KB
",[],0,https://forums.tapas.io/t/unpaid-collaboration-looking-for-an-artist-partner/62803
26,Looking for a job as a Grammar checker,Collaborations,[],"Hi, This is my first time doing grammar check so please bare with me,  I really love reading webcomics in any Genre. I'm willing to do grammar check for free for the mean time because just like I said, I don't have experience with this but I'm willing to learn.","['Well i love it if you could help grammar check me but i think your More looking for webcomics than novels and my novel I know my novel have as lot of errors giggles so yeah its up to you if you want me out', 'Hi!\nNot meaning to be a jerk about it but I think I\'d be remiss if I didn\'t let you know that your post used the wrong word for ""bear with me"". And ""meantime"" is usually one word in your context. The phrase ""just like I said"" ought to have a comma before it. Sorry, sorry......\nYou did say you\'re willing to learn & I hope you get the gig & the chance to work with spelling & grammar checking. It\'s not easy & I had to pound it into my noggin when I was doing years of technical writing. If in doubt, Google is usually a good teacher.\nSomething else you can offer as a native English speaker (did I just assume too much?)... spelling and grammar can often be improved using aps, but sometimes non-native English speakers or non-US people (etc.) need help with cultural/societal things - like the right words to call levels in high school or the common name for a bowling alley and so on. Little things that are completely obvious to you but not someone living somewhere else and they can\'t be fixed with an ap. Your ""customers"" will appreciate that.\nGood luck & have fun at it. I\'m doing proofreading for a comic series and getting to see the story before anyone else is kinda fun.\nOh, one more thing, you might want to offer your services as ""proofreading"" instead of ""grammar checking"", just to show you\'ll be giving more value than any ap can do. Go get \'em! ', ""Thank you for pointing out my mistakes I really appreciate it. To be honest English is my second language and I'm not really good with spellings, I may get it wrong sometimes or all the time but I'm really working on it and of course with the help of Google. I really like reading webcomics that's why I trying to give grammar checker/proofreading a shot. I hope that you can help me out since you're more experienced than me. Thank you again."", ""I'm also a fan of novels when I was younger, but these days I’m more on webcomics, don’t get me wrong  I still like reading novels tho, but now not that much. I’m sorry I can’t help you for now I’m still learning, you know baby steps."", ""NO I asumed so lol beside my novels isn't one that i bet you want read anyways to help me fix giggles""]",8/9/2021 16:32,https://forums.tapas.io/t/looking-for-a-job-as-a-grammar-checker/62752
