,Topic Title,Category,Tags,Leading Post,Post Replies,Created,URL
46,Artist is found,Collaborations,[],"Okay, change of plans. My original post was a question for unpaid which you can read below. BUT, I've decided to also ask people what their fees are and maybe ask my fans if they're willing to invest as well as myself who would invest.
Artists: For example what would you ask for about 10 pages like this (I also love this style but then in color):


futekiya.com17



ReadPornographer by Maki Marukido- futekiya Blog
Read chapter one of Pornographer by Maki Marukido for free! Haruhiko Kuzumi's life changes forever the day he rams into novelist Renjiro Kijima...with his bike. A poor college student, Haruhiko can't compensate Kijima for the accident. So, Kijima...





If I agree to pay and do so upfront, I will ultimately buy commercials and the drawings belong to me to do with as I please. 
Below is my original post. 
I've written a mature BL prison story (that you can find here on tapas: https://m.tapas.io/series/My-cellmate-COMPLETED/info32  though on Wattpad, it is much more popular attracting thousands of reads a week. I've started/finished there in February/June '21 and it has over 16k comments for 50 chapters https://www.wattpad.com/story/260281383?utm_source=android&utm_medium=link&utm_content=share_reading&wp_page=reading&wp_uname=glasssvial2121&wp_originator=8Owh3uDBqsfdgpCmktuuCWOU6RTZR%2BdOdqG%2FZN7OJSckdJPcubrqnjwZ6AIxoMGYY4LfA976l60A%2F7WTzNDqoUJY4cFDPuWwKmmatvnbTvOFdaAT8cGYe0A2UVU0zJpT2 ), it's currently edited by an editor. I've had this idea of turning it into a comic. The story is loved by most that read it and I know precisely which scenes are most popular with the readers. 
I'm looking for someone to collaborate with, someone that I can make this a successful comic with together. I have ideas that I want to use but since this will be a collab, we can discuss things and artists probably know certain things better than I do. It's a long story so there should be some things cut out but it'll still be a long process, which means I need someone committed and reliable in pushing through till the end. 
If you're interested, you can send me an email at schildpadleeuw@gmail.com or send me a message so we can discuss things. 
I need someone over 18 (!) that isn't afraid to make mature content and BL. Don't message me if you are below 18. I'm looking for a mature slightly realistic vibe. Not childish and cute.
My goal is to put our comic love baby on Patreon by two creators (me 35% and you 65%). I think we can make this a success but you will need to put some time into it first. This book has been published twice on Wattpad and twice it gained over 600.000 views within a few months, staying high in the boyxboy/bxb/BL charts for months. (Okay, enough bragging hahaha).
Blurb story: An 18-year-old moved from the juvenile center to an adult prison facility and needs to take measures in his own hands to keep himself safe. He offers his new cellmate a deal...
Greetings S.","['Good luck! I hope you can find someone! ', ""Thanks, nmei, me too. It'll be so cool, I just know it "", ""Hi, I'm not sure if im interested in the type of drawing you want, that I can do it but it costs me because is not my usual style. This is similar to what you want?\nScreenshot_2021-07-28-22-45-10.png720x1280 243 KB\n\nScreenshot_2021-07-28-22-46-47.png720x1280 230 KB\nBut I wanted to advise you that to get an artist, you could try to get first the patreon or donations from your readers to pay for a first chapter and then continue with the division of the income. I advise you because I do not believe that any good artist will accept to start working without any guaranteed payment."", '<img src=""/uploads/default/original/3X/6/4/649a631779ed655f6de957a1954ea7b780508c5c.jpg"" width=""361"" height=""500"">\nEdit: my image didn\'t work. Here is a link https://read.futekiya.com/comic/5d135527604a8but27 then in color preferably. \nThis is the kind of style I\'m looking for. Just beautiful, mature, hot men. \nAnd yeah, it\'s a gamble for the artist, I guess I\'m looking for someone that is a risk-taker, haha. I don\'t like to ask readers for money upfront. I even dare to say I would like to have a few chapters ready before we even update. I want to find someone who loves to draw and sees potential in the story. \nI just know what I want and damn it that I can\'t draw myself. I\'m so often disappointed with NSFW comics and would want to see more hot ones out there. I really think there are quite a few people out there thinking the same as I do, though. But then again, I can never be sure  \nIf it doesn\'t work out, and I can\'t find someone I like enough to work with, it\'s still not the end of the world.', ""Maybe one of your readers/ fans would want to do it? Is the only explain that i had to someone that take the risk in that level of profesionalism...This is the painted version, but i don't take risk XD\nScreenshot_2021-07-28-22-45-17.png720x1280 494 KB\n"", 'Haha, still thanks, though, for showing me your work. You draw nice ', 'You seem to be asking for a lot. You are asking for great art in a specific style, long term, and unpaid work. Maybe try asking your wattpad readers for the job, some might love your work so much that they want to help. Good luck!', 'I feel so.demanding right now   I just saw it the other way around. Meaning: artist loves to draw BL, has trouble with plots, and gets an opportunity to use a plot and couple that already have created an audience to begin with.', 'But maybe I should look at this completely differently. Maybe I should be the risk-taker, invest a few hundred, to begin with, and then go on from there. Last night, I asked in my story on tapas if people would be interested and I got four reactions they were, which was more than I thought cause readers on tapas are usually not very responsive I think. \nEdit: I changed my topic text.', ""Really wish I could help but my skill is not that good yet if you've seen my comic, our styles are different. I need a job too because this pandemic is getting worse."", ""Thanks for clarifying! I'd help you but I'm underaged.I hope you will find your dream artist! There are plenty of great artists on this forums, give it some time and offers and quotes will start coming in. I love BL so I'll be happy for you if you can turn your novel into a comic. Happy art hunting "", 'Hi! I just saw this post and I thought of some things that may help you.\nFirst, you linked a manga in page/printed format, are you searching for someone who will draw your story in pages or in scroll down phone format. I think it may help both you and the artist since both have different rates, printing page being always more expensive.\nSecond, how frecuently do you wish to uploade. Most comics upload 1 per week, but that would probably be really expensive since that would became your artist full time job.\nIn my opinion, you should pay your artist before you start publishing since this is your dream project and you should be the one taking the risk. I know this wasnt your intention, but as an artist sometimes the ""sharing benefits"" feels like being asked for free art. Also, I understand comics are incredibly expensive, so my recomendation for funding it would be opening a patreon/kickstarted beforehand where you ask your readers for help in case they want to help you. Maybe in exchange you can give an extra chapter idk.\nI noticed that the art you are looking for is extremely beautiful, which probably belongs to a trained person. I would recomend searching on Artstation or twitting your job offers using the hastag comic works.\nGood luck in your search and project!', ""I have found my person  I have agreed with paying upfront and owning the commercials. We have agreed she will make a sheet and I can cut up the panels for vertical webcomic and I will add my own texts etc. So, I'm happy. If you guys like I could show a page when it's done "", 'Still, thank you for the message ', ""Your story is the first one I've read on tapas and I just wanna that I'm enjoying it very much  I see you've already found an artist, but if y'all need any extra help maybe I could be of assistance."", ""Ahhh thanks so much. I'm honored you read it as a first story. Do you have experience on tapaz with publishing comics? I only have it with novels."", ""No actually, I only made a account so the I could comment on this Post  ^^;;\nI am a experienced artist,  but I've never actually made a comic before, not a serious one atlest."", ""Hahaha, okay. Well let's see what me and my lady that draws make of it "", ""Well then I wish y'all luck""]",7/28/2021 11:00,https://forums.tapas.io/t/artist-is-found/62246
47,Writer looking for Artist [PAID] WEBTOON [CLOSED],Collaborations,[],"Hello everyone!
I am looking for an artist who genuinely cares about the work they do. Someone who is caring, responsible, enthusiastic, and driven by a vision. LONG-TERM; PAID. 
Project Status
I've written the entire script, which still requires some editing/proofreading but the main story is there.
Genre: Drama, Fantasy, Historical, Romance
Inspired by/similar to: Light and Shadow; Lucia; Like Wind on a Dry Branch; Under the Oak Tree (The art style I had in mind would also be similar to these webtoons.)
Synopsis:
After 6 years away at a secluded boarding school, Ginevra is finally recalled to her family estate for her grandmother’s funeral where her father tells her that she must accept an offer for her hand in marriage to Taren, the Duke of Maldoni and the heir of the power-lusty dukedom in the north, in order to secure her family’s future and safety. Having lost half her family in an accident 6 years prior, Ginevra accepts, and ends up in the claws of a manipulative, cold, and beautiful stranger – her husband. As she starts her life at the estate, hidden intentions, generational curses, and buried secrets from her own past begin to resurface, and Ginevra must learn how to tell perceptions from the truth, enemies from foes, her mind from her heart, while resisting Taren’s lethal charm, to stay alive.
About Me!:
I have experience as a published writer and film-maker. I've received awards for some of my short stories and the films I've co-directed have been featured at a couple of film festivals. I perpetually feel as if I have these worlds, stories, and characters in me which I feel compelled to share. I am a romantic at heart. I love stories which have strong and encouraging messages which inspire readers/viewers, stories which bring out the light in others.
Link to my general film website: https://www.tkebuchavaproductions.com/35
Compensation: This is a story that I just really want to tell. I want to work with someone talented, responsible, and enthusiastic, who also shares my vision. Message me if interested and let's negotiate. 
Please message me if you are interested in collaborating (or know someone who may be a good fit), and I can send an excerpt of the script 
Thanks!","['Hi, I’m loving this proposal. I really like the example comics you mentioned as well. Some of my work is here:https://drive.google.com/drive/u/0/mobile/folders/1g1bTaFampi55QD_S-Z9qgZ2xkOFwzUvI?usp=sharing_erp_m&userstoinvite=nachiketn.89@gmail.com&ts=60c94b7f&actionButton=150\nPlease feel free to dm me if you like what I have. Thanks!', 'This seems like a brilliant idea. 10/10 would read.', 'wow I love your art!', 'Thank you! ️ I appreciate that', ""I'm interested! You can see examples of my art here:https://www.instagram.com/tamapochi_art/24"", 'Thank you so much! <3 I hope you can read it one day.', 'Hi I just sent you a msg ', 'do you have an Instagram or something I could follow perhaps?', ""Hello!  If you are in need of a digital colorist, feel free to contact me! i'm available for long term work.Here's the link to my portfolio5discord: Jaye#0214my email: jayesumire@gmail.comThank you so much "", 'hi! would love to work with you. here2 is my portfolio, and here2 is my art blog.\n\ndress illo.png1024x1191 714 KB\n\nthanks for your time!']",7/27/2021 15:53,https://forums.tapas.io/t/writer-looking-for-artist-paid-webtoon-closed/62223
48,Looking for staff to join our shounen manga server,Collaborations,[],"Hello there, this is the Contender Cody Productions. The manga series is based on Shuriken Rantō Cryptoverse, a Japanese manga series by Fujima Kunisada. It is a Shounen manga where people fuses with Crystal Monsters to get supernatural powers to save the world. Here is what we're looking for:
Translator
Typesetter and Cleaner
SFX redrawer
Panel redrawer
Censorship Director (role taken)
Proofreader
Editor
Anyone is welcome to join and volunteer, please join our discord server! The Contenser Cody Productions11",[],0,https://forums.tapas.io/t/looking-for-staff-to-join-our-shounen-manga-server/62264
49,Need a Co Writer,Collaborations,[],"Yo! Still looking for additional Writers to help develop this new Novel.As I stated, all I need is for someone to write just a part, and you have free control over what you want to do, as long as it can line up with the Overall Story. Already have someone on it, but we can use another mind to fill in the cracks.The Story is this...
It has been approximately one year since the newly discovered Aleo Virus has swept the globe, resulting in the comprehensive disintegration of society. Transmitted by saliva, and by transferring blood, the Virus will deteriorate the thought processes in the victim, increasing hostility and a craving to devour.As yet, there is no cure, but a Vaccine has been considered...
We need someone to write Act 4 to end the First Chapter.Get at me, and talk to me if you want in.This could be your story just as much as it is mine.","['Are you paying for it or is it unpaid?', 'How should I contact you ??', ""I'm wondering the same thing."", ""I'll be honest, I would be interested but I'm a bit of a control freak, so I'd probably be tempted to edit or go back over the other writers work to catch plot holes , grammar, and tighten up plot points. That's why I don't usually work with other authors, but if you're alright with someone coming in and editing over all, then I think I'd be interested.""]",7/24/2021 17:50,https://forums.tapas.io/t/need-a-co-writer/62107
50,Writer looking for an Artist for a Webtoon Project (closed),Collaborations,[],"Introduction: Hello I'm part-time writer (hobby), but I have been writing stories since I was in elementary school on the wattpad app. I am really passionate about writing that I finally decided that it is time to turn it into a webtoon and show it to everyone. Project Details / Pitch / Sample : I have the documents for the project details, so if you're interested please comment down and provide your contact info as well! The genre is : Action,Fantasy and Comedy It will be in a scroll-down format and colored.It has tons of magic-related scenes and fight scenes - so if you have experience then that would be great!
Paid or non-paid? Collaboration? Partnership?It will be a partnership, so I am looking for an artist who is enthusiastic about the project. I am willing to pay PER CHAPTER although it will be small amount of money since I am still a college student. I will be willing to split the revenue (if there will be), since I do have some people looking forward on the project .
Skills you are looking for / what you are looking forI am looking for an artist who has an anime/manhwa art-style. As for the project, it will be a team webtoon project - however the artist I am looking for will be doing the character and main arts. Required Software (Optional)I actually don't have a required software, I am fine with anything as long as it can provide you with the effects. If it doesn't, I do have a Clip Studio account that I can lend you to help you as well 
Schedule/scale (Deadlines, the length of the work, etc)The length of the project will be a little bit long, since it is still on-going.  I am not very strict of getting suggestions or corrections with the script - so feel free to tell me! As for the deadlines, I do like to be productive because if I don't I won't be able to get anything done at all - so for the webtoon posting, I actually prefer if we post every week. BUT - we will be working on five or more episodes done before posting the first episode in that way we can get a week off to work on the future episodes. ( I don't know if that makes sense). Let me know if it still doesn't work for you. Further information will be provided if you're really interested, you can also send me a dm on my instagram!
Contact info (Be it through PM's here or outside the forums)Instagram : evesd02213Twitter : evesan78825501Link to your Portfolio and/or Previous WorkPlease visit my wattpad account : evesd02213 I have a oneshot of BL done for my English Project but I made it long time go, and I have an unfinished story posted as well. It might have a lot of grammatical errors since I never bothered editing them because I became busy with my schoolworks.","['Hi just sent you a msg on instagram ', 'Hi, I am interested too. You can view examples of my work here: https://www.deviantart.com/sushy00/gallery/35187145/comics6\nPlease send me a message or e-mail me at sushychan(at)gmail.com if you want to work with me.', ""I'm down depending on the number of panels per chapter10-15 panels 50$15-30 panels 100$30-50 panels 500$Per chapter.Some of my artworks\nUntitled181.jpg1000x1000 380 KB\n\nUntitled200_20210607182105.png800x1280 248 KB\n\n20210530_010116.png672x1010 343 KB\n\nUntitled218_20210701010708.png1200x1920 482 KB\n\n20210728_002215.png800x1245 798 KB\n\nUntitled213_20210621180224.png1008x1344 739 KB\n\nVamprincess Vertical thumbnail_20210719172832.png864x1536 772 KB\n""]",7/28/2021 5:22,https://forums.tapas.io/t/writer-looking-for-an-artist-for-a-webtoon-project-closed/62238
51,I am an artist and I want to illustrate your comic 😀 [CLOSED],Collaborations,[],"hello my name is jovian, I have been drawing for a long time now and I've always wanted to work on a comic. I can draw in what ever style and id love to find a writer who wants to collaborate. I'm 18 years old and I'm studying film in university so I am often pretty busy with uni work and all that, but I've been making more time in my life for art again and id like to use it working on something I've wanted to do for a very long time now.I want to work on a one shot or something short and I'm willing to work for free. I'm open to longer story's but I'm less likely to pick them because of time restraints.
here's some examples of my art
baby low res.jpg3000x3000 118 KB

alien guy low res.jpg3000x3000 316 KB

chloe moriondo low res.jpg3000x3120 140 KB

skull man low res.jpg2662x2714 116 KB

gas mask man low res.jpg2412x2536 190 KB

clown man low res.jpg3000x3000 377 KB
I enjoy doing monster and alien art the most, but I also love drawing basically everything else as-well,so I'm open to any genre.you can find more on my Instagram. https://www.instagram.com/jovians_art/20
if you want to message me, I'm new to tapas so it might be safer to send me a message through my Instagram.
thank you so much for reading.","['your art is awesome!', ""thank you so much. and wow, I wasn't expecting people to see it that quickly."", 'Do you do character pin ups?', 'You have a really cool sort of oil painting-y style!', ""I haven't done pin ups before but I can try. I have done a lot of figure drawing and portraits as-well as character concept art so I'm sure its not too different."", ""Hi! doing a comic, at least in my case is very close to a full time job. If you really want to collab with someone I would suggest oneshots. \nOr what I'll personally look into in the future, someone with actual skills doing for me a full page or important panels to give more impact to key moments. \nAgain, the main problem is time.\nCool artworks by the way."", ""thanks dude. Id be happy to do some panels or a page for you if that's what your asking. just shoot me a message if you have key moments."", 'Also here is an example of some art i drew a while back in a more cartoony style. ill draw something in a anime/manga style as-well since that seems to be pretty popular on tapas\npage test low res.jpg3000x4776 612 KB\n', 'Ah your artworks are so cool!! 🥺', 'The rendering is so amazing!', 'Cool artworks Amazing art\u200b', 'Dont need an artist, but I think you would be awesome w/a short horror one shot. ', ""How much would you charge for character pinups or portraits? I'm prepping to write a story and I would love some character concepts or pinups."", 'Ideally I would charge 50$. but you can Dm me and we can sort something out.', ""I'm afraid I can't offer you the writing you seek for but I do wanted to say it looks really cool ""]",7/26/2021 16:43,https://forums.tapas.io/t/i-am-an-artist-and-i-want-to-illustrate-your-comic-closed/62178
52,Hot single artist near your area :o [ CLOSED ],Collaborations,[],"Hey, I'm an illustrator and animator looking for a partnership. I prefer to work with other people, so I'm trying to find someone compatible that likes to write entertainment, and maybe a little weird, stories.
Right now, I'm focused on pitching some manga ideas for viz originals, mainly as an exercise, but also interested in sharing something online.I'll be doing the art, help with the writing, and the revenue we'll be shared 50/50.
I like stories with unique premises, and I'm open to most genres (shounen, comedies, sci-fi, thrillers, romance, sports, slice of life).
Edit: Closed for now","['\n\ncoolio:\nohboyohboy#7857\nsent u a DM on discord', ""That's a pretty good thread title, I'll give you that"", 'I LOVE YOUR ANIMATIONS PLEASE TEACH ME\nSeriously though, which program do you use? Adobe?', ""I don't need an artist but let me say that your animations are so flawless."", 'Your art and animation is as coolio as your username! \nLooks amazing!', 'I use adobe animate (flash) ^^ I like the simplicity of the program. And in combination with after effects and photoshop, you can make anything.', ""wow ⍥⃝\nI've been trying to practice animation but I'm just way to impatient to actually finish anything."", 'I understand.. I start crying after a few hours ', ""I'll send you a dm on discord. I've got a few ideas and am willing to work on any of yours and help with designing animals, creatures/monsters, and characters"", 'I know it says closed for now but I hope we can discuss something in the future! Cause I got a pilot idea for a Martial Arts, high schooler Webcomic', ""Ahwww, I can't see the illustrations 🥺🤧""]",7/9/2021 12:35,https://forums.tapas.io/t/hot-single-artist-near-your-area-o-closed/61427
