,titles,replies,views,activity,category
0,"Tapas Paster for Novelists by miqinviolin 🕮
[image] Hello, novelists! We would like to share Tapas Paster, a FREE Google Chrome extension created by miqinviolin. It allows novelists to paste formatted text into the Tapas novel editor while retaining bold & it… read more",6,427,Dec '20,writing-novels
1,Story Endings Poll,427,15,2m,writing-novels
2,Tell us about your book!,2,377,10h,writing-novels
3,I’ll read your novels!,15,2.9k,12h,writing-novels
4,Just published my first few episodes of my novel. Post your new novel here too!,52,951,12h,writing-novels
5,Share Your Stories - I’ll Read Them (Novels),377,312,13h,writing-novels
6,Post your BL Novels here,137,100,1d,writing-novels
7,Anyone currently writing a Xianxia or Wuxia?,2.9k,57,3d,writing-novels
8,I want to create a monster taming comic about cryptids need feedback,76,33,3d,writing-novels
9,What do you think about diary entries?,951,186,3d,writing-novels
10,Finding Success While Writing In Niche Genres,52,253,4d,writing-novels
11,"Strange, Weird, HUH? with Kindle Vella Writers",312,1.6k,5d,writing-novels
12,Post ONE random sentence from your latest chapter,16,15.5k,5d,writing-novels
13,I just started writing a novel and I want to get comments and suggestions for my work,100,245,6d,writing-novels
14,POST 2 lines of dialogue between any Two characters from your NOVEL,7,9.7k,6d,writing-novels
15,Alpha Alien Romances,57,104,7d,writing-novels
16,Post The Last Sentence You Wrote,0,19.2k,8d,writing-novels
17,How do I even begin?,33,170,8d,writing-novels
18,What role could a mail carrier play in a fantasy adventure?,18,114,9d,writing-novels
19,Prompt of the day- ‘you’re an idiot’,186,87,9d,writing-novels
20,"Give Me Your Romance Novels! Steamy, Clean, or Fluffy I Want Em!",15,611,10d,writing-novels
21,Cover of your novel!,253,821,11d,writing-novels
22,Let’s have a BL Novel Showcase! (I want to find BL novels to read!),279,2.6k,12d,writing-novels
23,How to type this?,1.6k,126,12d,writing-novels
24,Slow or fast pacing stories,1.3k,190,12d,writing-novels
25,Y’all looking for BL/GL novel suggestions? ‘Cause I am! (You may self-promote!),15.5k,5.4k,13d,writing-novels
26,Is Omegaverse a dirty word now?,7,541,14d,writing-novels
27,Can you post a novel on tumblr?,245,107,15d,writing-novels
28,"What makes your chracter feel like a living, breathing person to you?",807,269,17d,writing-novels
29,The Underated Books Club (please read first message before posting),9.7k,214,18d,writing-novels
30,How do you feel about interrupting trains of thought in the first-person perspective?,10,96,19d,writing-novels
31,The Moonlight Smile that Stole My Heart,104,51,20d,writing-novels
32,"📺 Share Favorite Vids about Scene-Sequencing, Worldbuilding or Storytelling/Writing etc",1.3k,107,20d,writing-novels
33,HELP! I need help with my novel,19.2k,176,20d,writing-novels
34,When it comes to making webtoons should I…,14,104,21d,writing-novels
35,On Comedy: Punching Up vs. Down,170,192,22d,writing-novels
36,Share Omegaverse and mpreg novels/stories,11,670,22d,writing-novels
37,Your Out of Context Sentences (Promote Your Story),114,9.6k,23d,writing-novels
38,Story vs writing skill,2,264,24d,writing-novels
39,World Building. What’s your magic system?,87,162,25d,writing-novels
40,HELP! With the Classes and Ranks for my novel,33,104,26d,writing-novels
41,Mafia novels not so popular or is it just me?,611,107,27d,writing-novels
42,Where can I post unwanted scripts?,85,105,27d,writing-novels
43,Please Help ;__; I’m confusing myself with my own plotline T^T,821,242,27d,writing-novels
44,How much should authors explain about their work? (+poll),259,215,28d,writing-novels
45,Share a Content Advisory for your Series!,2.6k,300,28d,writing-novels
46,New Novelists! share your novels and we can check eachother!,9,1.3k,29d,writing-novels
47,There are 18 types of windows - what useless facts did you learn from writing your novel?,126,98,30d,writing-novels
48,I wanna do some cover art for FREEEEEEEE!,20,304,30d,writing-novels
49,Worldbuilding questions!,190,186,Jul 4,writing-novels
50,Ajuda para escrever,84,54,Jul 2,writing-novels
51,Share your favorite part from your novel,5.4k,228,Jul 2,writing-novels
52,Would you read this (deep fantasy version) ~ UPDATE,28,102,Jul 2,writing-novels
53,I’m leaving tapas and here is why,541,563,Jul 1,writing-novels
54,Share experiences about novels or comics,6,172,Jul 1,writing-novels
55,"I asked this of artist, now for Writers!",107,542,Jul 1,writing-novels
56,When PRODUCERS come KNOCKING,25,279,Jul 1,writing-novels
57,Any good novels/comics with Transgender characters?,269,141,Jul 1,writing-novels
58,Share Your Stories! (R4R Novels Only),14,110,Jul 1,writing-novels
59,Share your Novel cover!,214,17.7k,Jul 1,writing-novels
60,Hi! hola mundo!,3,127,Jun 30,writing-novels
61,"Hello all, I have a new novel I’m working on, I would like some critique on it",96,61,Jun 30,writing-novels
62,Novelists Post Your Novels Here!,0,10.4k,Jun 29,writing-novels
63,Wanted to Share this Scene,51,60,Jun 29,writing-novels
64,Searching for Slice of Life stories (call for self promotion),4,2.0k,Jun 29,writing-novels
65,"Writers, what’s your writing process like?",107,322,Jun 28,writing-novels
66,Q & A Questions,8,113,Jun 28,writing-novels
67,Death of a character in your writing,176,228,Jun 27,writing-novels
68,VERY IMPORTANT: Did anyone get contacted by Webnovel…?,2,353,Jun 27,writing-novels
69,Does anybody get writers anxiety?,104,140,Jun 25,writing-novels
70,Amazon Kindle Vella - TOS & Pros and Cons Discussion,9,427,Jun 25,writing-novels
71,Writing paralysis,192,134,Jun 24,writing-novels
72,When do you post your story/chapter?,11,200,Jun 23,writing-novels
73,Your favourite qoute from a novel?,670,113,Jun 23,writing-novels
74,I need help choosing a MC name,694,131,Jun 23,writing-novels
75,After a short hiatus,9.6k,93,Jun 23,writing-novels
76,"I want to improve, just don’t know how or where",22,125,Jun 22,writing-novels
77,How is Tapas for Novels?,264,902,Jun 21,writing-novels
78,Your crush finally confessed their love for you! Now it’s your turn,16,224,Jun 21,writing-novels
79,How often do you edit your chapters?,162,191,Jun 21,writing-novels
80,Do images work for every viewer or do you find some images are missing when you read?,8,91,Jun 21,writing-novels
81,What’s your thoughts on sex scenes in novels?,104,754,Jun 18,writing-novels
82,Action vs. Dialogue (+poll),3,121,Jun 16,writing-novels
83,Redeeming the Toxic Suitor,107,217,Jun 15,writing-novels
84,How to die (funny and unexpected way)?,5,265,Jun 15,writing-novels
85,First POV vs third POV for litrpg/gamer genre,105,74,Jun 14,writing-novels
86,Help me decide my next novel/novella! (Stuck on two ideas),22,79,Jun 14,writing-novels
87,Brainstorm Help,242,217,Jun 13,writing-novels
88,Seems like an interesting idea for a plot,18,86,Jun 11,writing-novels
89,Emotional wounds from characters and how to handle it,215,190,Jun 10,writing-novels
90,Villainess novels suggestion?,33,119,Jun 9,writing-novels
91,What’s your writer process?,300,84,Jun 9,writing-novels
92,Contract offer | Advice needed!,91,177,Jun 7,writing-novels
93,What techniques do you employ to bring your characters to life?,1.3k,262,Jun 6,writing-novels
94,A bunch of useful resources for writing,14,110,Jun 6,writing-novels
95,What is about a review that you like?,98,97,Jun 6,writing-novels
96,Share some of you favorite parts from you’re novel!,13,121,Jun 3,writing-novels
97,Anyone else writing slice of life / reading slice of life novels?,304,73,Jun 3,writing-novels
98,Changing the Setting,16,104,Jun 1,writing-novels
99,Novels on Tapas,186,521,Jun 1,writing-novels
100,Do any authors on here have experience with the Libri app?,0,138,May 29,writing-novels
101,Proofreader needed for novel,54,175,May 28,writing-novels
102,Writers! What’s the one thing you feel like your writing/characters are incomplete without?,25,368,May 26,writing-novels
103,Would You Read This? (NEW EDIT),228,172,May 26,writing-novels
104,What’s in a title,3,263,May 26,writing-novels
105,Planned Timeskip?!,102,144,May 26,writing-novels
106,Horror vs. Unease (+poll),12,172,May 25,writing-novels
107,I need some advice plz,563,263,May 25,writing-novels
108,Question About Scene in Novel? T^T,17,82,May 24,writing-novels
109,The beauty of weak characters,172,289,May 23,writing-novels
110,Works in progress for novels!,51,105,May 23,writing-novels
111,Food and Books. Let’s talk Cookbooks!,542,65,May 23,writing-novels
112,Looking for mythpoeia novels!,20,181,May 23,writing-novels
113,Thoughts on racism in fantasy works?,279,293,May 23,writing-novels
114,Stories you will never write,14,402,May 22,writing-novels
115,Your creation process,141,161,May 21,writing-novels
116,Less details= Bad story?,10,310,May 21,writing-novels
117,I’m new to writing and need tips,110,401,May 21,writing-novels
118,"Hello, Exposition, My Old Friend 😭🤦‍♂️ [Comics, Novels and All Writing in General]",440,237,May 21,writing-novels
119,Was writing easier for you when you were younger? (+poll),17.7k,439,May 20,writing-novels
120,Let’s talk about trends,13,280,May 20,writing-novels
121,Can DM’s be a thing in novels?,127,232,May 19,writing-novels
122,List of your favourite novels on Tapas,2,72,May 18,writing-novels
123,"Hey, I’m bored. Share your novels with me!",61,1.8k,May 17,writing-novels
124,Recommend your favorite tapas novel!,311,291,May 17,writing-novels
125,"Character Description, how much?",10.4k,260,May 17,writing-novels
126,Writers & artists of Tapas! What’s that one thing you’d never write/ draw even if you were getting paid for it?,0,468,May 16,writing-novels
127,How do you write a song that’s not about romance…?,60,175,May 14,writing-novels
128,So…I’ve been featured. What’s your biggest accomplishment as a creator?,32,471,May 14,writing-novels
129,Do you guys use art-breed in your work?,2.0k,305,May 11,writing-novels
130,Pitch me your novels!,25,314,May 11,writing-novels
131,Conflicting Views on Immortality,322,175,May 10,writing-novels
132,Anyone keeping track of Novalstar comments?,5,347,May 9,writing-novels
133,How Do You Promote Your Novel?,113,2.8k,May 9,writing-novels
134,First time in Tapas,17,78,May 9,writing-novels
135,Any Radish Authors?,228,366,May 8,writing-novels
136,Discord Server for writers to interact and share their stories,38,72,May 7,writing-novels
137,Does music make a difference?,353,134,May 7,writing-novels
138,Need a second opinion on my prologue,8,73,May 7,writing-novels
139,Help/feedback needed with novel draft,140,46,May 7,writing-novels
140,"Alright, I applied for Premium",19,193,May 7,writing-novels
141,Help with interest check on BL Novel,427,59,May 6,writing-novels
142,Restarting Drafts,6,70,May 6,writing-novels
143,That day i became a star novel,134,390,May 5,writing-novels
144,Which idea do you think is better?,19,157,May 4,writing-novels
145,A New Beginning to My Story,200,61,May 3,writing-novels
146,A One Shot about Issues Prevalent in Countries Like Mine,12,142,May 3,writing-novels
147,Politics in Fiction (OPINIONS NEEDED),113,391,Apr 29,writing-novels
148,What is the best way to connect the readers with your lore?,12,116,Apr 28,writing-novels
149,First Chapter Rewrite or not? Please Help if You Can,131,131,Apr 28,writing-novels
150,Novel Swap! Introduce Your Novel!,2,2.9k,Apr 26,writing-novels
151,How do you stay in touch with the little details?,93,189,Apr 26,writing-novels
152,Ways to quickly develop a character,8,142,Apr 26,writing-novels
153,You and the boys are chilling in your captor’s basement. Wyd?,125,193,Apr 26,writing-novels
154,Who’s launching a new book this summer? Tell me about it! (social media promotion),17,48,Apr 25,writing-novels
155,The two sides of subversions,902,78,Apr 25,writing-novels
156,Daily Writing Check-in,27,6.7k,Apr 24,writing-novels
157,I Need Some Feedback on this Scene,224,137,Apr 24,writing-novels
158,Shameless self-promo,25,127,Apr 24,writing-novels
159,Interesting BL Novels in Tapas,191,1.1k,Apr 23,writing-novels
160,Thoughts on Novel Covers?,8,170,Apr 23,writing-novels
161,Modern mythology reading circle,91,95,Apr 23,writing-novels
162,Novel length: too wordy for online reading?,67,218,Apr 23,writing-novels
163,Is Tapas the best place to post long-chapter stories?,754,188,Apr 22,writing-novels
164,Recomienden sus novelas en español (Spanish novels),6,945,Apr 22,writing-novels
165,World Building. What’s unique in your setting?,121,242,Apr 22,writing-novels
166,Someone recommend good bl to me,18,128,Apr 22,writing-novels
167,Hidden Siblings?,217,161,Apr 21,writing-novels
168,PROMOTE your Stories! But only using the scariest scene!,23,338,Apr 20,writing-novels
169,Five Ways for Pansters to Plan,265,192,Apr 20,writing-novels
170,“What is mana?”,13,278,Apr 20,writing-novels
171,Making a villain a victim,74,226,Apr 20,writing-novels
172,Kindle Vella Update,0,410,Apr 19,writing-novels
173,How to fix a crappy story?,79,446,Apr 19,writing-novels
174,What Are Your Thoughts on Second Male Leads?,21,343,Apr 19,writing-novels
175,Looking for story building and writing advice!,217,255,Apr 19,writing-novels
176,Finding historical european maps HELP,8,93,Apr 19,writing-novels
177,Gaming the system,86,173,Apr 19,writing-novels
178,How do I get subscribers on Mangatoon,9,126,Apr 18,writing-novels
179,Post a passage relating to a word game,190,138,Apr 18,writing-novels
180,Review and sub’s for novel writer,5,288,Apr 18,writing-novels
181,Any advice for writing blurbs?,119,149,Apr 18,writing-novels
182,Recommend some novels related to business,7,92,Apr 17,writing-novels
183,Getting Your Character Voices “Right”?,84,188,Apr 17,writing-novels
184,Does Chapter Length Matter?,11,199,Apr 17,writing-novels
185,"If you have ADHD, check this out",177,156,Apr 17,writing-novels
186,HORROR WRITERS what inspires you to write?,25,128,Apr 17,writing-novels
187,New novel FIND YOU AGAIN,262,70,Apr 17,writing-novels
188,How to reach out readers?,5,142,Apr 16,writing-novels
189,What genre do you enjoy writing the most?,110,185,Apr 16,writing-novels
190,Choosing A Genre from a strategic position,3,159,Apr 16,writing-novels
191,Bublish (an interesting site I stumbled upon),97,123,Apr 15,writing-novels
192,Is Prolific Problematic?,12,392,Apr 15,writing-novels
193,Top Web Fiction Invites!,121,115,Apr 15,writing-novels
194,Recommend me template for book,1,75,Apr 15,writing-novels
195,Amazon now doing web novels,73,151,Apr 15,writing-novels
196,Historical Fiction Category?,5,360,Apr 15,writing-novels
197,First page of my draft novel <3,104,85,Apr 14,writing-novels
198,Flex Your Achievements!,38,254,Apr 14,writing-novels
199,Recommend Me Stories! — Connecting Avid Readers and Emerging Authors,521,1.7k,Apr 14,writing-novels
200,Why you should watch more than just kids’ shows,7,209,Apr 14,writing-novels
201,Google Drive or Microsoft Word?,138,260,Apr 13,writing-novels
202,Looking for Joseon novels,8,114,Apr 13,writing-novels
203,Thinking about converting my comic into a novel,175,108,Apr 12,writing-novels
204,First Draft Rant,56,198,Apr 12,writing-novels
205,Hello First Time Writers,368,118,Apr 11,writing-novels
206,Is it nomal to lose motivation when writing a second draft?,10,173,Apr 11,writing-novels
207,Should You Edit/Revamp Published Chapters?,172,222,Apr 11,writing-novels
208,I have chosen my next BL novel to publish on Tapas! MC sketch inside ;),23,147,Apr 11,writing-novels
209,Advice for new (SFW) romance writers,263,197,Apr 11,writing-novels
210,Question on changing the setting,7,142,Apr 11,writing-novels
211,How to get out of a writing rut?,144,181,Apr 11,writing-novels
212,Worth Updating Episode 1,10,100,Apr 11,writing-novels
213,"Hello there! I’m looking for someone to help me translate my story from Spanish to English. (Shared rev, 50/50)",172,121,Apr 9,writing-novels
214,Drop an unreleased portion of your novel,19,165,Apr 9,writing-novels
215,"Favourite chapter of your story, briefly explain why",263,260,Apr 9,writing-novels
216,Need Help With An Idea I have for My BL Novel?,3,165,Apr 9,writing-novels
217,Promote someone else’s web novel here!,82,874,Apr 9,writing-novels
218,2k words a day challenge?,24,136,Apr 8,writing-novels
219,Need Novel illustrations?,289,112,Apr 8,writing-novels
220,Read for Read or Critique for Critique!,9,247,Apr 7,writing-novels
221,Post your bite-sized episode one here and i’ll read and subscribe to those i find interesting,105,256,Apr 7,writing-novels
222,2 Months of Publishing,12,190,Apr 7,writing-novels
223,Slow burn or nah?,65,244,Apr 7,writing-novels
224,I’m not exactly sure how to write my story the way I want to,8,120,Apr 7,writing-novels
225,Need some help coming up with a name for something,181,105,Apr 7,writing-novels
226,Kakao and Radish,22,221,Apr 7,writing-novels
227,Post novels that aren’t yours,293,81,Apr 6,writing-novels
228,Bright Morn of Issareth down,31,98,Apr 4,writing-novels
229,Fun Facts Shared With Your Readers,402,186,Apr 4,writing-novels
230,Why do you like writing?,12,309,Apr 4,writing-novels
231,How did you choose your protagonist’s sword?,161,197,Apr 3,writing-novels
232,What bad habits are you trying to lose?,18,177,Apr 2,writing-novels
233,Yes you can post to Vella from free sites - with conditions,310,159,Apr 2,writing-novels
234,At the mercy of the reader,12,332,Apr 1,writing-novels
235,I would like some critique please!,401,116,Mar 31,writing-novels
236,Pantsers… when the muse drops on you big time,14,150,Mar 31,writing-novels
237,Any Plotters Around?,237,279,Mar 31,writing-novels
238,Show vs Tell Advice - Getting the timing right,26,128,Mar 31,writing-novels
239,Novel Description Feedback,439,141,Mar 30,writing-novels
240,"ADHD in you, in me, and our writing",12,184,Mar 30,writing-novels
241,"Feedback Needed, Pretty Please!",280,198,Mar 30,writing-novels
242,Can somebody please help with my series!?,17,146,Mar 29,writing-novels
243,Other platforms for novels,232,293,Mar 29,writing-novels
244,Is this scene too short or too long?,2,102,Mar 28,writing-novels
245,I’ll draw your OC if you,72,135,Mar 27,writing-novels
246,Closing of the Amazon Vella thread,164,110,Mar 27,writing-novels
247,Let me write a scene for your character (0/3),1.8k,283,Mar 26,writing-novels
248,Scene study and why you might want to take an acting class,25,78,Mar 26,writing-novels
249,“Backhanded” Compliments,291,251,Mar 25,writing-novels
250,Amazon vs Wattpad,34,448,Mar 24,writing-novels
251,New spam for writer alert,260,78,Mar 24,writing-novels
252,How rhythmic is your writing?,72,99,Mar 23,writing-novels
253,Short story ideas,468,143,Mar 23,writing-novels
254,Snappy real life comeback lines in life and writing. Share here,17,100,Mar 22,writing-novels
255,A keep-you-on-egde supernatural BL novel,175,71,Mar 22,writing-novels
256,On getting an advance on a book,21,146,Mar 22,writing-novels
257,What do you enjoy about rewriting?,471,96,Mar 21,writing-novels
258,Waiting for Novelstar,13,179,Mar 20,writing-novels
259,Would You Read My New BL Novel?,305,88,Mar 20,writing-novels
260,My Book check it out !1,30,75,Mar 20,writing-novels
261,Amazon Kindle Vella (part 2),314,149,Mar 20,writing-novels
262,Is it okay to write folk-tale based stories?,8,156,Mar 20,writing-novels
263,So how are dealing with your covers?,175,283,Mar 19,writing-novels
264,Testing for plagiarism,32,222,Mar 17,writing-novels
265,Younger Writers - How to Sound “Adult”?,347,147,Mar 17,writing-novels
266,Tips on Writing Dialogue,44,178,Mar 16,writing-novels
267,Feedback on my dialogue. Is this dialogue boring?,2.8k,130,Mar 16,writing-novels
268,Secret Challenge,2,100,Mar 16,writing-novels
269,How do authors write?,78,100,Mar 15,writing-novels
270,Places to advertise web novels,10,159,Mar 14,writing-novels
271,"Chapter 10 Milestone, Promoting my Isekai light novel, Check it out",366,68,Mar 13,writing-novels
272,The Authors voice out in the real world,0,157,Mar 13,writing-novels
273,Does your writing style bore your readers?,72,243,Mar 13,writing-novels
274,"Trope Talk, Let’s go one step up",9,218,Mar 12,writing-novels
275,Name your novel/comic as if it was a light novel,134,213,Mar 11,writing-novels
276,TV option negotiations,5,127,Mar 11,writing-novels
277,The one word idea behind your story,73,428,Mar 10,writing-novels
278,Writing Jam 2.0 (Novels Only),0,534,Mar 8,writing-novels
279,Is my writing style okay?,46,76,Mar 8,writing-novels
280,Motivation to Write,5,122,Mar 7,writing-novels
281,A bit of a weird ethical sitch,193,186,Mar 6,writing-novels
282,Nervous about taking the plunge,0,127,Mar 4,writing-novels
283,What fun things do you do for your fellow writers?,59,84,Mar 4,writing-novels
284,How Much Should You Rewrite?,2,228,Mar 3,writing-novels
285,Wild Speculation,70,154,Mar 3,writing-novels
286,Is It Okay to Post Fanfiction?,4,110,Mar 3,writing-novels
287,“You’re not a good writer”,390,372,Mar 3,writing-novels
288,Having a “rant” mate and why it’s important,10,133,Mar 2,writing-novels
289,Fantasy (Especially Dark Fantasy) Recommendations for Articles,157,101,Mar 2,writing-novels
290,Accepting each other,0,140,Mar 2,writing-novels
291,Plotter or Panster? Which are you?,61,310,Mar 2,writing-novels
292,Writing styles? First person vs Third Person? Past vs Present? Mental Fortitude,3,203,Mar 2,writing-novels
293,Requests for short stories of main series from readers - opinions?,142,93,Mar 1,writing-novels
294,Weeb fanfic novelists,36,154,Feb 28,writing-novels
295,I want to write my own book,391,184,Feb 28,writing-novels
296,Writing Fictional Towns,7,155,Feb 28,writing-novels
297,Writing rant: Novel edition,116,411,Feb 27,writing-novels
298,Question about pitching to tapas,6,212,Feb 27,writing-novels
299,How Do You Deal With Writer’s Block?,131,343,Feb 27,writing-novels
300,Harsh Truths about Writing,122,222,Feb 26,writing-novels
301,Fantasy story: Do I have to teach a lesson?,2.9k,185,Feb 26,writing-novels
302,Would you read a story based on card battles?,15,79,Feb 26,writing-novels
303,Battle Shonen fans (I’m promoting my novel inspired by it and to chat),189,89,Feb 25,writing-novels
304,Character Motivation,7,198,Feb 25,writing-novels
305,Greek Mythology stories,142,1.4k,Feb 24,writing-novels
306,How to convey dehumanizing tone?,11,145,Feb 24,writing-novels
307,Rejection- How do you view it?,193,191,Feb 23,writing-novels
308,Contemporary YA Writers/Novels,0,142,Feb 20,writing-novels
309,Sketchy(-ish) Recruits on Comment Sections?,48,99,Feb 20,writing-novels
310,Fantasy/Sci-fi Writers Assemble! (Share your novels!),0,981,Feb 19,writing-novels
311,I need yall thoughts about my poem,78,85,Feb 19,writing-novels
312,"Novels with music, wanna here your playlist",1.2k,96,Feb 19,writing-novels
313,"Sunday reading, reading your first chapters (CLOSED)",6.7k,338,Feb 18,writing-novels
314,"Hello, everybody!",6,105,Feb 18,writing-novels
315,Popular tags. What tags are you using?,137,138,Feb 18,writing-novels
316,Editing Talks with Books,2,130,Feb 17,writing-novels
317,Feedback On My Novel Descriptions,127,84,Feb 17,writing-novels
318,What is Tapas word count limit for Novel Chapter uploads?,40,89,Feb 16,writing-novels
319,"Writing Punches, pushes and fights",1.1k,120,Feb 15,writing-novels
320,"Tips for Pantsing, Plantsing, or Literary Gardening",7,95,Feb 14,writing-novels
321,Motivation for writers,170,235,Feb 13,writing-novels
322,Are you planning on turning your writing into an audiobook?,2,108,Feb 12,writing-novels
323,How graphic is M rated in Tapas?,95,126,Feb 12,writing-novels
324,Best Social Media Outlets To Promote Novels,30,147,Feb 12,writing-novels
325,For novels specifically but comic creators feel free to chime in!,218,161,Feb 11,writing-novels
326,Feeling blah and bored. Show me your novels,8,338,Feb 11,writing-novels
327,Creating plots for a queer romance,188,165,Feb 10,writing-novels
328,New To Making Covers- ADVICE NEEDED,9,187,Feb 10,writing-novels
329,Writing BL Novels?,945,210,Feb 9,writing-novels
330,"Covers for a series I am working on, what do you think?",28,170,Feb 8,writing-novels
331,How do you write numbers?,242,130,Feb 8,writing-novels
332,"One Month, 5 Chapters",3,153,Feb 7,writing-novels
333,What’s the last Paragraph You Wrote?,128,231,Feb 6,writing-novels
334,What was the latest chapter or episode you wrote?,8,128,Feb 6,writing-novels
335,"New Creator here again, Proper Introduction",161,70,Feb 6,writing-novels
336,I just finished uploading the most important chapter of my story so far! AND I’M EXCITED!,36,83,Feb 5,writing-novels
337,Emotion-linked powers: love ‘em or hate ‘em? (+poll),338,181,Feb 4,writing-novels
338,Some musings on whether to write a series or not,9,71,Feb 4,writing-novels
339,Referral of good battle game (physical) w/board & men,192,63,Feb 4,writing-novels
340,Overuse of some filler words,24,140,Feb 4,writing-novels
341,Remember that really bad story you wrote when you were ten?,278,206,Feb 3,writing-novels
342,Repetitive words (not filler words),5,112,Feb 3,writing-novels
343,How Did You Choose Your Novel Title?,226,340,Feb 3,writing-novels
344,Let’s discuss about your novel’s magic system,60,272,Feb 2,writing-novels
345,Starting a sentence with “and” or “but”,410,184,Feb 1,writing-novels
346,Fantasy writers… an art prompt for you today,32,120,Feb 1,writing-novels
347,Have a favorite paragraph that inspires you to write more?,446,71,Feb 1,writing-novels
348,Showing “Behavior” to Writing,22,119,Jan 30,writing-novels
349,Positive Vibes please?,343,168,Jan 30,writing-novels
