,titles,replies,views,activity,category
0,"“Previously, on…” Recaps, yay or nay?",7,53,32m,questions
1,If your comic became an anime/tv show what would your opening and closing songs be?,53,2.6k,3h,questions
2,What song would be good as your opening song of your series and share your comic and novel,52,348,3h,questions
3,"Why is it that most women like romance, and most men like action?",2.6k,525,13h,questions
4,What are your favourite print comics/graphic novels?,30,28,15h,questions
5,How’d YOUR Characters React if Their Dorm is on FIRE? [Sheet Included],348,98,17h,questions
6,How long do you think an episode should be?,40,154,18h,questions
7,“Hiring” Artists & Tax-related Questions,525,134,1d,questions
8,Is there a Tapas official Discord server?,2,79,1d,questions
9,Send notification poll,28,104,1d,questions
10,Help me HTML wizard your my only hope! Data Scraping?,11,34,1d,questions
11,"Important question, extremely super duper important",98,207,1d,questions
12,Do you guys use Discord to promote your comic/novel?,9,165,1d,questions
13,Whats one concerning fact about your main villain?,154,220,1d,questions
14,Question of the day-childhood edition!,10,80,1d,questions
15,Your story as a song?,134,262,1d,questions
16,What are the things most important in a storyline?,3,62,1d,questions
17,What do you HATE drawing the most?,79,188,1d,questions
18,How do you guys planned locations and landscapes for comics?,9,125,1d,questions
19,Which COVER do y’all prefer!,104,78,1d,questions
20,Questions for Tapas Novel Writers!,0,158,1d,questions
21,Print versions of your comic?,34,48,2d,questions
22,Bizarrely specific request for help with a sound effect,13,83,2d,questions
23,Help me pretty pls? Even a simple Yes/No would help a lot,207,97,3d,questions
24,Any comic artists/writers here that aren’t ACTUALLY artists/writers?,16,177,3d,questions
25,What would you like to see in a cult webcomic?,165,121,3d,questions
26,How strong is you Main Character,27,276,3d,questions
27,How’d YOUR Characters respond to “You’re the Chosen One”? [Sheet Included],220,134,3d,questions
28,"Are my commissions overpriced for my skill, or…? Looking for opinion",6,276,3d,questions
29,Need help exporting comics to tapas,80,94,4d,questions
30,Free Place to host my own comic?,44,136,4d,questions
31,Question of the day -authority edition,262,89,4d,questions
32,Any of y’all just on Tapas as a Side-Gig?,3,327,4d,questions
33,Which Special Should I make For My Comic?,62,46,4d,questions
34,Anyone interested in Space Westerns?,53,69,4d,questions
35,Looking for a BL comic!,188,59,4d,questions
36,Question of the day- smart edition,7,105,4d,questions
37,How do you buy time between posts for your comic and what do you do?,125,102,5d,questions
38,Im searching for a novel in tapas,6,53,5d,questions
39,Prefered tablet and SW to draw comics,78,48,5d,questions
40,How do you quicken the pace?,14,166,5d,questions
41,What challenges are you expecting to face with your Comics or Novels?,158,171,5d,questions
42,What do you guys think about BLs with NO mature scenes and/or content?,1,320,5d,questions
43,How long does it take to draw a page,48,97,6d,questions
44,Comments or Likes? Let the War Begin!,3,258,6d,questions
45,What platform do I use to promote my webcomic?,83,72,6d,questions
46,Does tapas punish hiatuses?,4,362,6d,questions
47,Was it easy for you to get started with comics/novels?,97,120,6d,questions
48,Grammatical Question…For or About.?,24,84,7d,questions
49,Do Writers Use Instagram for Writing?,177,142,7d,questions
50,Scripting- do you reckon you should have the whole thing written out?,8,101,7d,questions
51,How do you plan out your comics/novels?,121,234,7d,questions
52,Mature Content Limitations,44,204,7d,questions
53,Question of the day- cleanliness edition,276,148,7d,questions
54,Do you have a character or characters with no story?,14,264,8d,questions
55,Anime or not Anime art style,134,685,8d,questions
56,Ink as Donation?,20,76,8d,questions
57,Hi I wanna post it to my fb but is it allowed to promote my novel in fb,276,59,8d,questions
58,Adoptable Ideas? Thoughts?,23,93,9d,questions
59,Has anyone on here ever translated your series into another language?,94,184,9d,questions
60,Which Story Idea Do You Like The Most?,8,89,9d,questions
61,Do half of page or all?,136,94,9d,questions
62,Do you know voyce.me?,8,471,9d,questions
63,How did you pick the font for your novel or comic title?,89,173,9d,questions
64,What Composer would you get to do the soundtrack to your story?,33,286,10d,questions
65,Is it ok for me to write about this?,327,204,11d,questions
66,I want to make a webtoon banner,0,97,11d,questions
67,Prompt of the day- ‘leave me alone’,46,75,11d,questions
68,How would you define love? BONUS: How important is “shipping” to your enjoyment of a story?,6,177,11d,questions
69,Question of the day- smell edition,69,75,12d,questions
70,New from the Community Tapas duration?,2,115,12d,questions
71,Has this ever happened to you when making your comic/novel?,59,215,12d,questions
72,"Summary comic link in forum, how to do it",12,902,13d,questions
73,Can Slice of Life comics have a plot? Wondering about changing my genre,105,157,13d,questions
74,Black lines used for movement,7,177,13d,questions
75,INK Concerns (with MATH!),102,8.2k,13d,questions
76,Is it possible to change the name of your comic?,0,88,14d,questions
77,"I give up on Webcomics, What do I do with my drawing skills? [SOLVED]",53,289,14d,questions
78,Among big projects at Tapas: Who or what is Bunneh? [Poll] Now with a homepage,5,705,14d,questions
79,How thick is your skin? (y’know what I mean),48,804,14d,questions
80,Any tips for a scratched laptop screen?,33,64,14d,questions
81,"Are panty shots too distasteful, even if they’re realistic?",166,317,14d,questions
82,What is stopping you from starting your comic/novel?,34,173,15d,questions
83,What would your character sing at a Karaoke bar?,171,130,15d,questions
84,How has your first favorite comic or novel inspired your first comic or novel?,28,157,15d,questions
85,Any Experience with Webcomics App Submissions?,320,121,15d,questions
86,"Error blindness, and how you deal with it",13,124,16d,questions
87,Comic printer for low quantity/pages,97,42,16d,questions
88,Does this nicktoon short exist?,30,610,16d,questions
89,What keeps you reading a comic/novel?,258,136,16d,questions
90,Looking for a comic that I forgot to subscribe to,1,75,17d,questions
91,An Attractive Comic,72,450,17d,questions
92,Why did you stop reading a comic/story?,14,730,17d,questions
93,Has a comic ever made you cry?,362,250,18d,questions
94,Where do you promote your novel?,8,71,18d,questions
95,Is fanfiction allowed on this site?,120,125,18d,questions
96,#tapastry not for comics?,5,335,18d,questions
97,Has anyone signed non-exclusive contract requiring ID?,84,164,18d,questions
98,What’s the limit for swearing?,13,155,19d,questions
99,Romance/Fantasy Clichés,142,114,19d,questions
100,A comic with…Alternative Endings?! 🤯,4,115,19d,questions
101,Can I reference videogame names in my comic?,101,76,19d,questions
102,Instagram art promotion accounts/spam?,29,124,20d,questions
103,What is the saddest scene you’ve had to write/draw,234,177,20d,questions
104,So has anyone PAID money for exposure/advertise,8,161,21d,questions
105,30 Character Questions,204,194,21d,questions
106,Printing a Very Little Comic,12,114,21d,questions
107,Are comics with 0 episodes visible?,148,93,21d,questions
108,Need advice for animal related project,35,92,22d,questions
109,What’s the one thing all your protagonists share?,264,221,22d,questions
110,Question of the day- memory edition,57,83,23d,questions
111,Publish a webcomic and rights,685,96,23d,questions
112,What steps do you take when writing antagonists?,6,199,24d,questions
113,Im a new writer and i need some advice,76,118,24d,questions
114,"Help, I’m trying to find a Tapas article about how to write an Novel`?",5,93,25d,questions
115,Animated Cover directions,59,67,25d,questions
116,Can you see animated covers on the app?,2,115,25d,questions
117,Character question of the day- death edition!,93,104,25d,questions
118,What is the craziest and/or weirdest thing have ever happened to you?,22,2.6k,25d,questions
119,What do you think about doing a world guide chapter or any “explanation” material in comics,184,100,26d,questions
120,Can we have a way to back up our long as hell novels?,5,159,26d,questions
121,What do y’all think of the new cover foe scrapyard Castaways?,89,52,26d,questions
122,I created new covers for my comic and book! which do yall like more?,2,60,27d,questions
123,Is it bad to take long breaks from your works?,94,146,27d,questions
124,I’m 14 can I publish my novel here and make some money?,25,198,27d,questions
125,Changed title name,471,76,27d,questions
126,Artstyle Wars: ink and coloring or Soft tones?!,18,148,27d,questions
127,Need help with a japanese character name,173,191,27d,questions
128,Length of a (light) novel,39,47,28d,questions
129,Do You Customize Your Characters In Video Games?,286,108,28d,questions
130,How to write a pet death,9,116,28d,questions
131,Book Clubs Question,204,99,28d,questions
132,Slice of life vs Drama,7,102,28d,questions
133,It’s understandable,97,179,29d,questions
134,I have been contacted by Dreame. Are they a scam?,1,191,29d,questions
135,I have a concern about this contract,75,270,29d,questions
136,What job do you work at other than create comics?,9,14.5k,29d,questions
137,Tips please for a new writer,177,105,29d,questions
138,"How would you publish this, any smart ideas?",4,123,30d,questions
139,Can you help me?,75,172,30d,questions
140,Why is HORROR/MYSTERY so often used in anthology/short series?,3,114,30d,questions
141,A Question about Tapas Ink Offers,115,90,Jul 5,questions
142,Does Clickbait Make You Popular or Hated?! 😡,22,281,Jul 5,questions
143,Episode not appearing in website fresh - why?!,215,251,Jul 5,questions
144,Do you know website that can translate text on images?,8,288,Jul 5,questions
145,How to add 2 custom ad banners,902,85,Jul 5,questions
146,Webtoon creator summit?,4,121,Jul 4,questions
147,What are your thoughts on hiatuses?,157,216,Jul 4,questions
148,Your dreams and motivations for writing your novel / making your comic,7,187,Jul 4,questions
149,Ngl the biggest reason i do my threads that i do,177,163,Jul 4,questions
150,I’m starting a YouTube Channel on how to use Clip Studio Paint. What should the video be on?,285,95,Jul 4,questions
151,Clip Studio Paint Printing Quality Issues,8.2k,104,Jul 3,questions
152,Unclear TOS- sexual content?,2,171,Jul 3,questions
153,Could I insert a hyperlink into a the text?,88,69,Jul 3,questions
154,What Should I Do With Comic Pages After Chapter Is Done?,21,87,Jul 3,questions
155,How do I promote my upcoming series?,289,105,Jul 3,questions
156,Does Tapas offer traditional format?,21,103,Jul 2,questions
157,What are tapas rules on showing and depicting drug use(fictional drug use),705,116,Jul 2,questions
158,How often do you update your work?,36,87,Jul 2,questions
159,How Do I Protect My Comic Script When Having Someone Look At It?,804,107,Jul 2,questions
160,"One, i don’t know how to sort this question two, discord",4,61,Jul 1,questions
161,Just a general forums formatting?,64,76,Jul 1,questions
162,How to promote on social media?,30,152,Jul 1,questions
163,"Can someone please tell me, how ad revenue works?",317,106,Jul 1,questions
164,Cost for assistance?,20,169,Jul 1,questions
165,I have a pokemon comic. Any Pokemon fans over here?,173,111,Jul 1,questions
166,How do you stay productive/occupied during an art break?,15,621,Jun 30,questions
167,Should i put a shonen,130,122,Jun 30,questions
168,Anyone had this comment before on their work here?,10,145,Jun 30,questions
169,Should fan comics get their own category?,157,82,Jun 29,questions
170,Finding a lost comic,4,88,Jun 29,questions
171,Which animes deserve another season?,121,6.3k,Jun 29,questions
172,"Help, can’t remember name of mature BL comic",6,84,Jun 29,questions
173,Dreame and what is it?,124,90,Jun 28,questions
174,Omegaverse yaoi? Shounen ai? Idek manga i want to find,0,441,Jun 27,questions
175,What should I do to share my characters design,42,98,Jun 27,questions
176,Losing followers after being edited,5,162,Jun 26,questions
177,How do you promote your comic on Instagram?,610,104,Jun 26,questions
178,Does my comic look blurry to you?,9,138,Jun 25,questions
179,How do you tell if your Serial Killer Novel is More of a Mystery or a Horror Novel?,136,78,Jun 25,questions
180,Volumes vs chapters,1,69,Jun 25,questions
181,Hello Again! Please help,75,81,Jun 25,questions
182,"Artist inside a Comic, How to do it?",42,92,Jun 25,questions
183,Can I use car brands in my comic?,450,106,Jun 25,questions
184,Tapas Ink and Monetization,50,89,Jun 25,questions
185,Need 3D models .. for my comic,730,231,Jun 25,questions
186,How to use Medibang Paint or Painstorm Studio with Drawing Tablets?,20,97,Jun 24,questions
187,Furry Forums for Novel?,250,77,Jun 24,questions
188,Why do you keep going?,3,534,Jun 24,questions
189,Is the main protagonist of my series a hero or villain?,71,519,Jun 24,questions
190,Post your very favorite “guilty pleasure” series!,7,89,Jun 24,questions
191,Can you bump your own promo threads?,125,106,Jun 24,questions
192,Got a writing invitation by a company. Advice please!,10,133,Jun 23,questions
193,Good Acrylic Paint! Looking for recommendations,335,164,Jun 23,questions
194,Tapas Premium Comics,7,155,Jun 23,questions
195,What’s the most annoying comment on a minor thing have you received?,164,900,Jun 23,questions
196,What do you think of the US?,10,4.3k,Jun 23,questions
197,Red has gone missing. Has anybody seen RedFromBlueLife?,155,478,Jun 22,questions
198,"If you publish on Tapas, does that mean you can’t publish your series physically?",9,150,Jun 22,questions
199,"If you could turn your character into a game, what kind of game would it be?",114,1.7k,Jun 22,questions
200,Someone tell me about ink and how it works?,6,122,Jun 22,questions
201,Will you like my comic?,115,197,Jun 21,questions
202,Questions About Commissions? I really need someone’s input! Dx,4,189,Jun 20,questions
203,Laptop (and maybe tablet) recommendation?,76,1.5k,Jun 19,questions
204,Having trouble with pitching for premium,7,114,Jun 19,questions
205,Similiar games to Mystic Messenger? (Or any good Otome game to play?),124,3.3k,Jun 18,questions
206,Who knows a nice movie making app for windows other than windows movie maker,15,403,Jun 18,questions
207,Tapastry tags on SoMe?,177,147,Jun 18,questions
208,Can I publish or not? Afraid to publish my comic,5,219,Jun 18,questions
209,What thing did you learn while doing research for your comic/novel?,161,178,Jun 18,questions
210,Good ways to attract interactive readers?,14,237,Jun 18,questions
211,My webcomic updating everyday but low views. Should I stop updating daily?,194,223,Jun 18,questions
212,Printing My Comic?,6,174,Jun 17,questions
213,Is there a different site meant for novels? Or is Tapas the best place?,114,177,Jun 17,questions
214,"Creators, I have a question for you",3,147,Jun 16,questions
215,Chapters or episodes,93,103,Jun 16,questions
216,How does a story even reach 500 subs?,9,373,Jun 16,questions
217,How did you start digital art and eventually making a comic?,92,235,Jun 16,questions
218,What are your opinions on fanfics involving real people?,34,1.3k,Jun 16,questions
219,What character and world concepts makes you excited?,221,127,Jun 16,questions
220,What do you think of the idea of creating a Wiki to your novel,9,68,Jun 16,questions
221,How effective is adding Music to your novels?,83,73,Jun 15,questions
222,How to find Inspiration again?,2,156,Jun 15,questions
223,What artist inspired you to make a Webcomic?,96,134,Jun 14,questions
224,How do You work in hot weather?,23,254,Jun 13,questions
225,Backlogs for new projects,199,71,Jun 13,questions
226,Sword fights vs Gunfights,15,141,Jun 13,questions
227,Any INTJ creators around?,118,326,Jun 13,questions
228,What are some good sites for making merch?,8,13.6k,Jun 12,questions
229,"Cant remember comic name, help 🥲",93,92,Jun 12,questions
230,How do you split royalties from ad revenue and support with your collaborators?,0,101,Jun 11,questions
231,Why is commitment so …. Scary?,67,189,Jun 11,questions
232,Poll: BL or GL?,16,112,Jun 10,questions
233,Who’s your favorite character in your comic?,115,206,Jun 10,questions
234,Paid Promotion Sites?,12,100,Jun 10,questions
235,What software do you use for animations on your webcomic?,104,2.1k,Jun 10,questions
236,Ads views. Help please,37,80,Jun 10,questions
237,How to Make Money with Tapas (INSTEAD OF WEBTOONS) youtu.be,2.6k,313,Jun 9,questions
238,How much do Tapas Originals make?,6,198,Jun 9,questions
239,Script or Not? What would you read?,100,141,Jun 8,questions
240,I’m learning to draw. Any advice?,10,251,Jun 8,questions
241,How to earn the honor of a Staff Pick?,159,2.7k,Jun 7,questions
242,Staff pick genre bias,2,462,Jun 7,questions
243,What’s your font setting for reading novel?,52,58,Jun 7,questions
244,Does anyone know anything about the inksgiving this year?,1,106,Jun 7,questions
245,How much of yourself do you give to your characters?,60,210,Jun 5,questions
246,Favorite genres,9,171,Jun 4,questions
247,Does anyone have artfight?,146,121,Jun 4,questions
248,How do I get a fanbase and tell good and bad things about our works,7,490,Jun 4,questions
249,What is Your overall honest feelings about the Tapas Comunity,198,681,Jun 3,questions
250,[Poll] Tell me your view on NSFW,2,443,Jun 2,questions
251,What Webcomics are you currently reading?,76,376,Jun 1,questions
252,Currently working on comic. May I ask for Advice?,11,130,Jun 1,questions
253,Patreon/Ko-fi Tips & Advice?,148,1.1k,Jun 1,questions
254,"Can someone Interest check, critique, or ideas for a comic idea?",11,90,Jun 1,questions
255,How many times your story has been rewritten?,191,246,May 31,questions
256,(voting poll) How many subscribers do you have added usually every time you update on Tapas and on Webtoon?,0,336,May 31,questions
257,Help uploading comic pages (not vertical webtoon format),47,103,May 31,questions
258,Is there a way to put 2 people as co-authors?,10,123,May 31,questions
259,"Cat/Fox/Wolf Girls, the CIA, and super soldiers - Would people on this site be interested in reading something new?",108,103,May 31,questions
260,Novels early access?,14,54,May 30,questions
261,Where to edit my ink goals?,116,50,May 29,questions
262,Can anyone help me by how to make money quickly?,5,127,May 29,questions
263,"I recived INK, magic?",99,126,May 29,questions
264,Can we get a pop up notification for mature series?,9,58,May 29,questions
265,The ad revenue stuff,102,115,May 28,questions
266,"Excuse me, need some help",9,168,May 28,questions
267,Is “yourwork” a scammer?,179,313,May 28,questions
268,Using Etsy for Your Work,7,104,May 27,questions
269,Do You Prefer Regular or Descending Order for Comics?,191,98,May 27,questions
270,BL and Lgbtq advice,14,235,May 26,questions
271,CSP Brush recommendations for ball point pen replacements?,270,126,May 26,questions
272,What tags to use in a Spanish comic?,433,78,May 26,questions
273,What do you think of INKR?,14.5k,250,May 26,questions
274,What are your experiences in advertising your comic on Instagram?,11,76,May 26,questions
275,Can I write fanfiction?,105,143,May 26,questions
276,Ethically/ Environmentally Aware Merch?,9,126,May 25,questions
277,Methods to talking to Readers,123,363,May 25,questions
278,How to “Kill Off” a Character?,6,265,May 25,questions
279,Delay Announcement Thread?,172,76,May 25,questions
280,"Creators - how can I help YOU? [promos, etc]",4,117,May 25,questions
281,How Do I Keep Gaining Subscribers?,114,231,May 25,questions
282,Writing rebellious characters,4,151,May 25,questions
283,Anyone have a ko-fi shop?,90,141,May 25,questions
284,Is Shandong Huayang Culture Development Co. a scam?,26,1.9k,May 24,questions
285,Custom 3D models in CSP iPad version?,281,104,May 24,questions
286,Annoying drafting table ledge,49,130,May 23,questions
287,Questions for Comic Makers,251,263,May 23,questions
288,Buymeacoffe.com alternative for Patreon?,9,106,May 23,questions
289,How much does ad rev earn you?,288,443,May 23,questions
290,Suggestion for background for comic,3,136,May 23,questions
291,How do you “take a break”,85,211,May 22,questions
292,Does anyone else make music for their own story/someone else’s story?,3,249,May 22,questions
293,How to design title for book cover(」°ロ°)」,121,97,May 22,questions
294,Webtoon front page?,18,166,May 22,questions
295,Carrd or Linktree?,216,433,May 22,questions
296,What inspires you to make a webcomic?,19,133,May 21,questions
297,Question about time and viewership,187,256,May 21,questions
298,A Webcomic Tapas youtube Video Title suggestion?,9,109,May 21,questions
299,How Does Ad Revenue Work,163,164,May 20,questions
300,What art software you used to make your comic/art?,3,260,May 20,questions
301,Other sites to post novels,95,97,May 20,questions
302,Have you made the leap?,15,529,May 20,questions
303,Getting noticed “Very Lucky?”,104,280,May 19,questions
304,Designing Character Tips and Tricks Part 2?,9,68,May 19,questions
305,Comic / Sequential Art training methods. How to get into the habit of creating pages,171,198,May 19,questions
306,For how long do you plan your comic/series to run for?,2,1.8k,May 19,questions
307,Who is the most kawaii cutest thing in the world? poll,69,218,May 18,questions
308,How do people unlock support below 250 subs?,1,502,May 18,questions
309,How do y’all draw mirrors/reflections?,87,157,May 18,questions
310,Good way to draw dark/brown skin in black and white?,5,149,May 18,questions
311,How much gore can I put my story without getting block?,105,84,May 17,questions
312,Do you guys count your panel composition?,5,293,May 17,questions
313,How do you delete a topic?,103,125,May 17,questions
314,Doubts about NSFW content in tapas for creators,7,268,May 17,questions
315,"Fonts, fonts, fonts, pls i need fonts",116,1.8k,May 17,questions
316,Should I use the LGBTQ+ Tag?,10,511,May 17,questions
317,Plot as you go or completed before drawing?,87,275,May 16,questions
318,Is it worth it to put a novel on tapas?,4,227,May 16,questions
319,What steps should a newbie writer take to improve his writing,107,146,May 16,questions
320,Comic reboot approach,2,188,May 16,questions
321,Studio Tapas Pitches Questions (Novels),61,149,May 16,questions
322,Does music influence/inspire your writing?,3,171,May 15,questions
323,Does poetry do well on Tapas?,76,1.1k,May 15,questions
324,When did you feel that you had become decent at drawing and/or writing?,16,233,May 14,questions
325,What’s your favorite genre to write/draw?,152,177,May 14,questions
326,My comic is on hiatus till my hand works again! Anyone else here suffer from cubital tunnel syndrome or carpal?,5,534,May 14,questions
327,Anything else is there to change in my comic.. Reply,106,74,May 14,questions
328,Writing: Making Updates - “Send” vs “Don’t Send”,5,173,May 14,questions
329,Has anyone ever got a tapas banner request?,169,222,May 14,questions
330,How to delete forum account?,2,219,May 13,questions
331,Do you have an alter ego when you create your webcomic?,111,264,May 13,questions
332,Would appreciate feedback on choosing a genre,16,94,May 13,questions
333,The Other Milestones,621,148,May 13,questions
334,Premium or not I need some recommendation,2,307,May 13,questions
335,Profile Picture Social Media as a writer,122,109,May 13,questions
336,"When is everyone planning to go back to conventions, both attending and exhibiting?",9,148,May 12,questions
337,Fear of Success!?,145,162,May 12,questions
338,How do I set a whole story as Mature?,4,124,May 12,questions
339,Has anyone used Patreon’s merch fulfillment yet?,82,170,May 12,questions
340,What is the best way to develop a romantic relationship while skipping significant amounts of time?,2,183,May 12,questions
341,Does anyone has a facebook or twitter account just to share their work?,88,121,May 12,questions
342,Are there any new platforms to post your comic/novel?,147,102,May 12,questions
343,Help making a google form?,6.3k,85,May 12,questions
344,Need help finding a comic based off a description,2,83,May 11,questions
345,Need Help with Comic Cover,84,105,May 11,questions
346,Favorite Relationship Dynamics?,3,211,May 11,questions
347,"If a story is an allegory for a NSFW subject, does that make the story NSFW?",90,121,May 11,questions
348,"Computers, help please!",2,384,May 11,questions
349,How many subs before contracting help?,441,206,May 11,questions
350,Views and likes in Dashboard not the same as the ones in the actual link?,6,125,May 11,questions
351,If You Had a Big Budget to Promote / Work on Your Webtoon What would you do and Why?,98,259,May 11,questions
352,Curious regarding assistants,3,177,May 11,questions
353,Novel writers - what other platforms do you publish on?,162,203,May 10,questions
354,Suggestions for Poses for a Pin Up - Please Help!,3,71,May 10,questions
355,Unlock chapters with bonus ink (Lowest Prices),104,180,May 9,questions
356,Who is on Goodreads?,9,163,May 9,questions
357,Is Tapas accepting pitching for BL novels right now?,138,92,May 9,questions
358,How productive is promoting here over and over?,6,232,May 8,questions
359,Has anyone heard about this new webcomic publishing platform?,78,534,May 7,questions
360,Best way to run a give away?,2,47,May 7,questions
