,titles,replies,views,activity,category
1735,Building an audience on webtoon advice?,176,773,Jul '20,questions
1736,Preferred way to read a 4-panel comic?,24,197,Jul '20,questions
1737,Hi guys what you think about my manhwa ? Demon eggs,216,222,Jul '20,questions
1738,Are Book Covers Required Yet?,45,152,Jul '20,questions
1739,Should I skip my Friday update?,1.1k,225,Jul '20,questions
1740,Thinking whether to put a change to my schedule,9,114,Jul '20,questions
1741,How many of you listen to music/watch videos while making comics?,146,383,Jul '20,questions
1742,"Sub for Sub, how do you feel about it?",11,424,Jul '20,questions
1743,Non-Tapas Novel in Community Picks?,308,447,Jul '20,questions
1744,What is your biggest regret in comics / novels?,8,385,Jul '20,questions
1745,What are some ways to monetize your art?,1.4k,161,Jul '20,questions
1746,Do you play sports?,18,283,Jul '20,questions
1747,Perspective center of interest,199,140,Jul '20,questions
1748,Is it worth the try?,35,180,Jul '20,questions
1749,Any have experiences with Inkiit?,350,152,Jul '20,questions
1750,"Hi, guys, cover/chapter icons advice?",20,149,Jul '20,questions
1751,Good free drawing apps for Android tablet,204,114,Jul '20,questions
1752,"If I had a YT channel, how would I tell my Webtoon subscribers?",7,89,Jul '20,questions
1753,"If you have a game that simulate your life, you will",434,125,Jul '20,questions
1754,What reasons would make you drop your own comic / novel?,5,372,Jul '20,questions
1755,How do you advertise a novel?,107,141,Jul '20,questions
1756,Website background for manhwa free?,8,148,Jul '20,questions
1757,Your Opinion on -Tracing-,161,660,Jul '20,questions
1758,Where do you advertise your story?,24,391,Jul '20,questions
1759,What’s your prediction for the comics medium in 5 years? and 10?,329,267,Jul '20,questions
1760,Trigger warnings,4,438,Jul '20,questions
1761,I cant find this webtoon and it makes me sad,247,137,Jul '20,questions
1762,"If you pitch to premium, does it have to be an existing series?",30,765,Jul '20,questions
1763,What’s the origin story of your comic/novel’s title?,276,623,Jul '20,questions
1764,Other sites like Tapas?,10,868,Jul '20,questions
1765,What determines trending?,365,174,Jul '20,questions
1766,Another option that I think ink used to have,32,135,Jul '20,questions
1767,Do you ever feel sad for no reason?,273,176,Jul '20,questions
1768,How much time do you spend drawing every day to meet your deadlines?,199,402,Jul '20,questions
1769,Any example of a strange story concept that turned out really popular?,5.6k,534,Jul '20,questions
1770,How is your project different now from your original concept?,8,326,Jul '20,questions
1771,Other sites to post work on + patreon,157,245,Jul '20,questions
1772,Early access tapas,3,256,Jul '20,questions
1773,How’d you keep your story fresh after hundreds of chapters?,106,365,Jul '20,questions
1774,What’s Your Dream?,14,329,Jul '20,questions
1775,What do you do when someone continually pries into your work?,187,276,Jul '20,questions
1776,How Strict is Line WEBTOON?,0,15.6k,Jul '20,questions
1777,"Likes, views, subs and comments, which matters to you the most?",105,695,Jul '20,questions
1778,How much do you get paid for making a comic?,3,285,Jul '20,questions
1779,Do you need to change how you make your comics after a long time?,111,168,Jul '20,questions
1780,Better Platform?,31,240,Jul '20,questions
1781,Where can I enter my gag comic into a contest?,322,99,Jul '20,questions
1782,Lezhin Comic Challenge 2020?,7,485,Jul '20,questions
1783,Nintendo fanart question,163,142,Jul '20,questions
1784,Tabletop RPG (D&D and simillar) comics and novels?,6,240,Jul '20,questions
1785,Advice on two novels going at a time,192,220,Jul '20,questions
1786,Creating an accurate blurring effect,9,339,Jul '20,questions
1787,Characters Who are Karens,215,403,Jul '20,questions
1788,Patreon or Paypal for Webtoon?,14,613,Jun '20,questions
1789,What do you think of this comic?,165,134,Jun '20,questions
1790,Trying to add episode to my webtoons contest entry,11,118,Jun '20,questions
1791,Primary Genre Selection Discussion,140,211,Jun '20,questions
1792,Is this a fun BL title and premise?,13,189,Jun '20,questions
1793,How long did it take you to get your first like/sub/comment?,228,533,Jun '20,questions
1794,Where do you post “doodles” and art for your comic?,2,264,Jun '20,questions
1795,Where do you post commission ads?,149,143,Jun '20,questions
1796,Do people make a Discord server that is about their own comic?,29,2.0k,Jun '20,questions
1797,What fictional character do you aspire to be like?,265,359,Jun '20,questions
1798,Webtoon - short story contest - your story may be not in the contest without you realising it,5,323,Jun '20,questions
1799,Did you do a lot of correction on a chapter you updated?,130,323,Jun '20,questions
1800,How do publishing deals work?,3,200,Jun '20,questions
1801,What’s going on with Patreon?,140,412,Jun '20,questions
1802,How much money can you make from a website?,0,133,Jun '20,questions
1803,Suggestions and help picking a cover,92,169,Jun '20,questions
1804,Winners of contest what are the requirements before having your prize?,27,172,Jun '20,questions
1805,Appreciation post/Tell me your favorites!,395,411,Jun '20,questions
1806,Do you like AMV?,1,154,Jun '20,questions
1807,"Those who do comics the only right way, in page format: do you number your pages?",96,273,Jun '20,questions
1808,Medibang cloud save is not working,3,382,Jun '20,questions
1809,Pace of publishing your comic when you draw slowly?,125,174,Jun '20,questions
1810,DISCORD! Wanna join?,15,147,Jun '20,questions
1811,Readers who read for the sake of reading?,451,303,Jun '20,questions
1812,Thoughts on webnovel.com,8,456,Jun '20,questions
1813,Webtoon has problem with website?,167,129,Jun '20,questions
1814,Ever been conned by an artist before?,3,339,Jun '20,questions
1815,"Webtoons aren’t only comics, right?",157,469,Jun '20,questions
1816,Can I Use Brand Name Products in My Fiction?,3,332,Jun '20,questions
1817,What is the age demographic on Tapas?,104,314,Jun '20,questions
1818,Is there something I’m doing wrong?,6,307,Jun '20,questions
1819,What are your favorite webcomics?,124,324,Jun '20,questions
1820,"Help, what am I doing wrong?",6,1.3k,Jun '20,questions
1821,"If you were a character, what type of character would you be?",177,213,Jun '20,questions
1822,Help Designing Maps,18,146,Jun '20,questions
1823,Hey anyone lived in Las Vegas?,320,2.6k,Jun '20,questions
1824,"People value “shipping” way too much, why is that?",4,678,Jun '20,questions
1825,Why straight men don’t write romance aimed at straight women?,101,602,Jun '20,questions
1826,Should comic memes be used to promote your comic?,1,191,Jun '20,questions
1827,Should I keep the schedule or just upload when episodes are ready?,83,256,Jun '20,questions
1828,Does color affect your reading experience?,64,421,Jun '20,questions
1829,How do you craft your characters?,9.2k,312,Jun '20,questions
1830,Favorite Series and Sources of Inspirations,4,487,Jun '20,questions
1831,Help with sword drawing?,129,152,Jun '20,questions
1832,Get back a standard brush in CSP?,21,289,Jun '20,questions
1833,What do you think of Pewdiepie?(CLOSED BECAUSE I DON’T WANT THIS TO BECOME CONTROVERSIAL),319,245,Jun '20,questions
1834,Under what conditions would you accept a UNPAID collaboration?,31,735,Jun '20,questions
1835,"What do you think of Logan Paul? (CLOSED BECAUSE I’M BORED OF READING THE REPLIES, THEY’RE ALMOST ALL THE SAME AND CORRECT AT THE SAME TIME)",313,190,Jun '20,questions
1836,Do your characters play any instruments?,11,873,Jun '20,questions
1837,Tapas policy on swearing,204,218,Jun '20,questions
1838,How do I draw night settings?,15,204,Jun '20,questions
1839,Other Art Platforms?,257,206,Jun '20,questions
1840,Black and African Lead Characters in comics,0,3.9k,Jun '20,questions
1841,Looking for opinions on Robert Crumb,93,368,Jun '20,questions
1842,What’s your favorite youtube channel?,11,537,Jun '20,questions
1843,German Comics and Novels,219,119,Jun '20,questions
1844,Cover Art. What should I quote?,4,145,Jun '20,questions
1845,How do you go about using references in your comic?,89,339,Jun '20,questions
1846,How long do you have to be on Tapas to not be considered new?,7,168,Jun '20,questions
1847,Rewrite a chapter,171,213,Jun '20,questions
1848,Good places for Art Prints?,4,258,Jun '20,questions
1849,Ad Revenue Formula?,151,152,Jun '20,questions
1850,What do you guys think of manga scanlators such as Mangastream?,10,7.0k,Jun '20,questions
1851,Mangaforadult.com appears to be monetising some Tapastic comics,242,5.0k,Jun '20,questions
1852,Do guys read shoujo manga?,4,8.7k,Jun '20,questions
1853,Series with manga-style page formats?,111,1.1k,Jun '20,questions
1854,Manga! let’s chat about Manga!,5,779,Jun '20,questions
1855,Visual retcons and redesigns in webcomics?,177,186,Jun '20,questions
1856,Questions For Cover Artists,48,199,Jun '20,questions
1857,How to get Best Image Quality for Comics?,320,208,Jun '20,questions
1858,Looking For A Cover Artist!,17,139,Jun '20,questions
1859,"I need some Patreon advices, thank you",136,137,Jun '20,questions
1860,Help! I Can’t Find A Comic I Used to Read!,8,98,Jun '20,questions
1861,Future Projects?,719,559,Jun '20,questions
1862,How hard is it trying to start a Q & A style comic with low subs?,28,212,Jun '20,questions
1863,Publishing schedule for Novels,401,348,Jun '20,questions
1864,Do you know any other forums I could promote my comic on?,5,1.1k,Jun '20,questions
1865,Is someone here making webcomics for a living?,164,147,Jun '20,questions
1866,Back after a two-year hiatus – should I start over?,37,329,Jun '20,questions
1867,Adobe Illustrator or Photoshop class?,1.3k,192,Jun '20,questions
1868,Has anyone here self published? If so how did you go about doing it?,5,272,Jun '20,questions
1869,Can’t think of the right word/name,159,187,Jun '20,questions
1870,SFX fonts in manga,6,2.6k,Jun '20,questions
1871,What inspired the design of your monster?,133,710,Jun '20,questions
1872,Transitioning from Wattpad to Tapas: what are some things i should look out for?,39,273,Jun '20,questions
1873,Can I post Dungeons and Dragons based stories on Tapas?,329,182,Jun '20,questions
1874,How does the popular section work?,35,253,Jun '20,questions
1875,Contract questions,510,215,Jun '20,questions
1876,Manga or comic with very good swordfight?,18,376,Jun '20,questions
1877,Should I Be Writing In American English?,138,412,Jun '20,questions
1878,The Pit of Uncertainty,2,320,Jun '20,questions
1879,So all of a sudden my arms have stopped working (help? advice?),114,488,Jun '20,questions
1880,Why do you like or Dislike Certain Genres?,2,1.5k,Jun '20,questions
1881,Looking for a webcomic about a witch (?) raising two children,128,191,Jun '20,questions
1882,Translating sound effects into English,37,658,Jun '20,questions
1883,Trying to find a specific webcomic,602,105,Jun '20,questions
1884,Profile Stickers?,4,229,Jun '20,questions
1885,Comic strips… A good laugh is always needed,90,904,Jun '20,questions
1886,Tips on Changing Formats? (vertical scroll to print page),4,303,Jun '20,questions
1887,What needs a warning or mature content?,123,298,Jun '20,questions
1888,Popular Books That You Find Boring,34,516,Jun '20,questions
1889,Help Posting Writing on Tapas,914,153,Jun '20,questions
1890,"If I were to make an animation channel, what should it be about?",5,108,Jun '20,questions
1891,File Types: Which are allowed to upload?,142,209,Jun '20,questions
1892,"Wheelchair and Mobility Aid Users, how can I write a character to represent you?",7,494,Jun '20,questions
1893,You are an artist!,147,198,Jun '20,questions
1894,How would you imagine your villain’s theme to be like?,38,474,Jun '20,questions
1895,Should I slow down how fast I’m making comics?,334,190,Jun '20,questions
1896,Do you recommend tagging chapters?,12,160,Jun '20,questions
1897,Why do I have few views on Line Webtoon m.webtoons.com,278,626,Jun '20,questions
1898,Answer 3 questions and promote your comic,10,357,Jun '20,questions
1899,Is Tapas mostly for comics?,263,161,Jun '20,questions
1900,Can’t find the publish button - solved!,13,133,Jun '20,questions
1901,Possible scam? Might be targeting novelists,176,278,Jun '20,questions
1902,Is this a good cover?,7,216,May '20,questions
1903,How people discover comic on Tapas?,137,240,May '20,questions
1904,Webcomic Series Idea,19,160,May '20,questions
1905,How often do you change your characters clothes?,121,3.8k,May '20,questions
1906,Answer 5 fun questions about your comic! (And promote it!),9,564,May '20,questions
1907,How do you get ideas?,244,319,May '20,questions
1908,Manga update (thoughts?),19,163,May '20,questions
1909,Where is most of your inspiration from?,246,209,May '20,questions
1910,I got ink out of nowhere,2,240,May '20,questions
1911,"Apparently, Using Food to Describe Skin Tone is Racist?",142,1.4k,May '20,questions
1912,Does the voices fit the characters?,28,189,May '20,questions
1913,What’s your opinion on storytime animation?,480,376,May '20,questions
1914,"Greetings people, I am the great Duel doing a Q&A!",36,240,May '20,questions
1915,How can i promote my comic + advices for begginers?,897,532,May '20,questions
1916,Drawing hair (help!),6,375,May '20,questions
1917,Best free animation software?,192,208,May '20,questions
1918,How much money is possible from monetization?,31,221,May '20,questions
1919,How do you get visible on the Tapas app?,817,215,May '20,questions
1920,At 25 subs; Q & A session,23,176,May '20,questions
1921,"How to Improve Art, Really?",239,394,May '20,questions
1922,Anyone else struggles with names?,18,391,May '20,questions
1923,What Was Your Favorite Saturday Morning Cartoon?,305,327,May '20,questions
1924,What popular cartoon or anime and comics or manga do you currently watch and read?,4,4.0k,May '20,questions
1925,Italics appearing BIG on mobile,141,295,May '20,questions
1926,Changing character names in published works,29,169,May '20,questions
1927,What’s the deal with saying “your OC looks like”?,292,634,May '20,questions
1928,Looking for a Forgotten Comic I’ve read a few years ago,36,160,May '20,questions
1929,Your favorite series?,400,372,May '20,questions
1930,Chapter Unlock Prices,35,141,May '20,questions
1931,Linespacing in novels,2.1k,104,May '20,questions
1932,Do your comic or novel creating skills ever come in handy for unrelated situations?,2,216,May '20,questions
1933,Writing songs for a comic,94,128,May '20,questions
1934,Who’s Your Favorite Character in Web Comics?,12,354,May '20,questions
1935,Looking for mystery series,219,130,May '20,questions
1936,Q and A for The Dark Children of The Night!,16,146,May '20,questions
1937,Searching for a webcomic about concealing being perfect,213,114,May '20,questions
1938,Comic-Rocket link to Tapas.IO (any examples or tips),3,174,May '20,questions
1939,Do promotion threads work?,121,332,May '20,questions
1940,Webtoon questions,15,241,May '20,questions
1941,How Did You Build your Tapas Following?,265,419,May '20,questions
1942,How Many People Are On Tapas?,6,226,May '20,questions
1943,Ever struggled with motivation?,202,380,May '20,questions
1944,Is it a bad time to take a break?,3,208,May '20,questions
1945,Does anyone knows how many ad impressions on Tapas make a dollar?,206,178,May '20,questions
1946,Ad view to pennies?,66,496,May '20,questions
1947,How do I draw light?,6.1k,291,May '20,questions
1948,"Photography Camera Recommendations, Please",3,164,May '20,questions
1949,Do you guys enjoy testing new art styles?,127,333,May '20,questions
1950,Colors less vibrant in Tapas,7,410,May '20,questions
1951,Would it be jarring to switch my comic from traditional book page layout to the infinite canvas layout?,276,145,May '20,questions
1952,Need Help for Art Channel Ideas,6,141,May '20,questions
1953,Job that has cool name?,115,133,May '20,questions
1954,Confused on where to start this,20,330,May '20,questions
1955,Translated versions - best solutions?,305,114,May '20,questions
1956,What you can find inside a dungeon?,8,239,May '20,questions
1957,Social Media Recommendations for Archiving,224,220,May '20,questions
1958,Am being too harsh?,12,710,May '20,questions
1959,Let’s talk about soccer/football!,111,106,May '20,questions
1960,If you were to put end credits in your story what song would you use,39,627,May '20,questions
1961,What are you doing to help?,446,558,May '20,questions
1962,How Long Have You Had Your Story/Idea?,2,461,May '20,questions
1963,New idea for a web comic. Need some feedback,106,142,May '20,questions
1964,What made you want to make a novel or comic? (also promo stuff),13,299,May '20,questions
1965,Trying to remember an urban fantasy webcomic [Solved],512,156,May '20,questions
1966,How Fast can you Draw Pages?,28,592,May '20,questions
1967,How do u draw panels?,387,389,May '20,questions
1968,Posting my pre-existing comics to Tapas - upload all at once or pace it out?,13,211,May '20,questions
1969,How do you all choose titles?,1.4k,593,May '20,questions
1970,Can you put comics on WEBTOON that aren’t vertical format?,7,553,May '20,questions
1971,Do you guys play video games after working/drawing?,174,4.2k,May '20,questions
1972,Anyone else handwrite (or used to handwrite) their text? Should I just switch over to a proper font?,11,203,May '20,questions
1973,Who are some artists that influenced your Art and overall Style?,128,995,May '20,questions
1974,What tools do you use to draw your web comics?,31,621,May '20,questions
1975,What is Your Favorite Romance Comic/Novel Right Now?,336,1.7k,May '20,questions
1976,"If money isn’t a issue, should a Amateur artist hire an Higher level Artist?",11,353,May '20,questions
1977,Why are my subscribers subbed to so many people?,161,363,May '20,questions
1978,How to make comics enjoyable for someone who’s not that much of a comic reader?,0,292,May '20,questions
1979,Looking for a comic i misplaced,74,155,May '20,questions
1980,What’re some things you wish you knew before starting out?,4,248,May '20,questions
1981,Is spaming really worth it?,90,2.2k,May '20,questions
1982,"Help! I’m searching for a webcomic I read like 5 years ago, something about a zombie apocalypse and a secret organization behind some zombie mind control",1,134,May '20,questions
1983,Investing in your own printer?,106,572,May '20,questions
1984,Croppy sections too many photos…. Help,2,166,May '20,questions
1985,MediBang Paint problems,201,177,May '20,questions
1986,Just posted my very first comic! Does anyone have any advice about what I should expect?,0,151,May '20,questions
1987,Are there bots on Webtoon?,85,379,May '20,questions
1988,Mature content on Tapas?,5,250,May '20,questions
1989,Is tapas for writers?,154,1.6k,May '20,questions
1990,What do I do with my older comics?,5,190,May '20,questions
1991,"Setting up a Patreon, any tips?",157,157,May '20,questions
1992,From mobile or from PC?,23,428,May '20,questions
1993,How to set up multiple stickers on the Cricut,394,104,May '20,questions
1994,Manga update Schedule time,4,169,May '20,questions
1995,"I’m beginning to get tired of writing scripts for my comics, what do I do?",126,249,May '20,questions
1996,Has any comics/novels in tapas been turned into a book?,38,485,May '20,questions
1997,Do you think the judges of Webtoons Short Story Contest will read all of the submissions?,363,405,May '20,questions
1998,How can I get retweeted by Webtoon Canvas?,1,271,May '20,questions
1999,How much should writer royalties be?,87,236,May '20,questions
2000,Should I censor physical abuse?,4,205,May '20,questions
2001,Is it worth it to make every page its own episode?,139,219,May '20,questions
2002,Metaquid arrives with new video from graphic novel. What do you think?,2,233,May '20,questions
2003,Time zone for English Webtoon audiences?,141,184,Apr '20,questions
2004,Second Ad Banner (Closed),49,133,Apr '20,questions
2005,Can anyone help me with these fonts?,391,158,Apr '20,questions
2006,Questions about freelancing,6,364,Apr '20,questions
2007,Anyone know of any cool #drawthisinyourstyle challenges going on?,120,148,Apr '20,questions
2008,How Many Layers?,9,368,Apr '20,questions
2009,How do you promote a Webtoon?,114,174,Apr '20,questions
2010,What is the best way to promote my comic on tapas?,11,134,Apr '20,questions
2011,Question for anyone who’s published a comic AND a novel,176,169,Apr '20,questions
2012,How to create simple animation out of a drawing?,7,168,Apr '20,questions
2013,Webcomic format or traditional “cropped”?,189,193,Apr '20,questions
2014,"Better to use descending order, or start from first episode?",1,159,Apr '20,questions
2015,"When posting on both Tapas and Webtoon, do I publish different comics on both sites?",129,427,Apr '20,questions
2016,Changing the title of a year old comic,27,196,Apr '20,questions
2017,Some tips/advices for someone who wants to write a Slice of Life?,501,254,Apr '20,questions
2018,Uploading On Webtoon,7,187,Apr '20,questions
2019,Question to those of you who are running multiple series,269,308,Apr '20,questions
2020,Are the surveys safe?,14,635,Apr '20,questions
2021,Is This Allowed?,150,271,Apr '20,questions
2022,Why my blending pen isn’t working?,6,131,Apr '20,questions
2023,Is there any benefit to releasing multiple novel chapters in a day?,133,233,Apr '20,questions
2024,I just created a comedy comic about stickfigures; How do I build an audience?,9,172,Apr '20,questions
2025,Should I Post On Both Tapas And Webtoon?,117,784,Apr '20,questions
2026,Is there an issue using popular franchise references in your comic?,1,286,Apr '20,questions
2027,Cool manga to read?,148,581,Apr '20,questions
2028,Why are tapas and webtoon communities so friendly?,35,460,Apr '20,questions
2029,How do you promote your comics?,203,202,Apr '20,questions
2030,I need help with english localization,28,205,Apr '20,questions
2031,Quesion of tapas,264,148,Apr '20,questions
2032,Is the scrolling format the best layout?,7,280,Apr '20,questions
2033,What are all the components needed for world building?,178,444,Apr '20,questions
2034,A better way to work with word count limit,47,129,Apr '20,questions
2035,Character Development Assistance,556,147,Apr '20,questions
2036,Is there a way to hide your series?,4,405,Apr '20,questions
2037,My episodes are too big for tapas. Help!,157,222,Apr '20,questions
2038,Can comic chapters be too short for Tapas readers?,4,153,Apr '20,questions
2039,Bell notification headache,150,878,Apr '20,questions
2040,What is the best social media to promote your webcomic?,21,362,Apr '20,questions
2041,"I can’t verify my age even though i am over 18, what can i do?",971,528,Apr '20,questions
2042,What’s your preferred novel update method,18,249,Apr '20,questions
2043,How do you keep going on?,204,302,Apr '20,questions
2044,Is it normal that I worry alot about what I write,35,241,Apr '20,questions
2045,Do you think this sort of political comedy fits in here?,293,160,Apr '20,questions
2046,How long does it take you to do a page?,5,2.6k,Apr '20,questions
2047,How would one make an informative comic entertaining?,163,171,Apr '20,questions
2048,The “Don’t do your Magnum Opus first” argument,41,807,Apr '20,questions
2049,What is your weakness?,6.7k,992,Apr '20,questions
2050,Too Much Time on your hands,7,166,Apr '20,questions
2051,Help! Does anyone know why tapastic doesn’t want to open me?,106,137,Apr '20,questions
2052,Should each comic page be a new episode?,10,127,Apr '20,questions
2053,How do featured artists make so many panels per WEEK?,160,8.2k,Apr '20,questions
2054,Differences between OBS Studio and Streamlabs OBS?,2,135,Apr '20,questions
2055,Should I switch to Clip Studio Paint?,128,971,Apr '20,questions
2056,Difference between cell shade vs soft shade?,2,705,Apr '20,questions
2057,Is there a time of day or day of the week you’ve found that people check the “Fresh” comics more than others?,91,126,Apr '20,questions
2058,Fear of a new creator up and leaving,17,525,Apr '20,questions
2059,What novels do you reccomend I read,258,184,Apr '20,questions
2060,My Webtoon Won’t Come,17,201,Apr '20,questions
2061,Will I stay on Binge? (Also what are binge requirements),154,345,Apr '20,questions
2062,Do Tapas own your comic when it gets featured,18,361,Apr '20,questions
2063,Are You Struggling to Create With Current World Circumstances?,419,411,Apr '20,questions
2064,The topic of Racism in Webcomics?,13,214,Apr '20,questions
2065,How do you find new comics to read?,146,177,Apr '20,questions
2066,SNAFU comics - yay or nay?,12,560,Apr '20,questions
2067,"Comparisons, do you like them?",210,408,Apr '20,questions
2068,Time for the big question!,7,396,Apr '20,questions
2069,Are doujinshis allowed here?,169,257,Apr '20,questions
2070,LINE Webtoon GIF,109,6.2k,Apr '20,questions
2071,How do you get Tapas HQ to read your book?,6.4k,382,Apr '20,questions
2072,How would you celebrate a sub milestone?,21,249,Apr '20,questions
2073,Should I use kawaii style for silly comics?,382,247,Apr '20,questions
2074,What do you prefer to read in a novel-,2,255,Apr '20,questions
2075,Can you zoom in to panels on Webtoon?,107,368,Apr '20,questions
2076,Webtoons comic is unrated? And doesnt appear on search,62,383,Apr '20,questions
2077,How do some comics get recommended on webtoon?,269,1.6k,Apr '20,questions
2078,Insults in a webcomic,5,398,Apr '20,questions
2079,New to forum and being flagged as spam,85,463,Apr '20,questions
2080,Do you keep your workspace tidy? How?,10,669,Apr '20,questions
