,titles,replies,views,activity,category
5261,"Some colour advice, please?",348,1.9k,Dec '16,questions
5262,Who wants me to check out their comic?,9,1.6k,Dec '16,questions
5263,App/Software to make GIFs?,339,580,Dec '16,questions
5264,Should I have waited until I knew my comic looked good?,4,1.3k,Dec '16,questions
5265,Finding request for a comic,200,480,Dec '16,questions
5266,"¿si mi comic es español, es lo mismo que si es en ingles, respecto a los ajustes?",9,557,Dec '16,questions
5267,What are the industry standards for a comic book studio/ What policies would you like to see in a comic book studio?,239,755,Dec '16,questions
5268,Comparing yourself with other creators… How to overcome this?,16,3.8k,Dec '16,questions
5269,Episodes updates vs New episodes?,343,685,Dec '16,questions
5270,What are some of your comic challenges?,5,1.0k,Dec '16,questions
5271,How long has the story/ lore for your comic/novel been in your mind?,695,1.8k,Dec '16,questions
5272,Music for focusing on your work,24,1.1k,Dec '16,questions
5273,How Do You Gauge Interest in a Possible Kickstarter Campaign?,536,496,Dec '16,questions
5274,Thoughts on posting your comic to different sites?,6,618,Dec '16,questions
5275,Proper scripts for artists?,254,627,Dec '16,questions
5276,LASIK and Working Digitally,6,396,Dec '16,questions
5277,Have you had a mentor for your comic?,286,1.9k,Dec '16,questions
5278,Comic Fan Casting,0,441,Dec '16,questions
5279,In your oppinon what is so compelling about a long running narrative?,218,1.4k,Dec '16,questions
5280,How Do You Keep Going When You Don’t Have Time,12,1.2k,Dec '16,questions
5281,Need held finding artist,363,383,Dec '16,questions
5282,What’s your favorite character of your series?,8,2.2k,Dec '16,questions
5283,Anyone got tips on descriptive writing?,445,1.5k,Dec '16,questions
5284,What is your TOP THREE lesser known TRAGEDY comics,4,978,Dec '16,questions
5285,Should I mark this as NSFW?,313,621,Dec '16,questions
5286,Do you use a smartphone for drawing?,4,7.9k,Dec '16,questions
5287,Is it possible to publish with two accounts?,204,365,Dec '16,questions
5288,Webtoon line help!,3,8.2k,Dec '16,questions
5289,I need help on panelling,278,880,Dec '16,questions
5290,[Problem - Clip studio paint] Brush size goes only till 100 instead of 2000,45,1.0k,Dec '16,questions
5291,Do you have an Artist Website?,1.2k,1.6k,Dec '16,questions
5292,Inktober participation,39,1.8k,Dec '16,questions
5293,Those moments while creating your story,4.3k,1.1k,Dec '16,questions
5294,What’s your process of making/writing a story comic?,14,4.8k,Dec '16,questions
5295,I Wanna Hear About Your Pets’ Names!,743,5.6k,Dec '16,questions
5296,Submitting comics on multiple sites?,33,5.7k,Dec '16,questions
5297,Is anyone learning a new language?,1.2k,2.3k,Dec '16,questions
5298,What if you could make a video game out of your comic?,1,1.5k,Dec '16,questions
5299,Thanks for Subscribing,181,813,Dec '16,questions
5300,Do we need to mind the filesize of our pages?,57,381,Dec '16,questions
5301,Does anyone know any good romance comics that aren’t BL?,1.4k,4.5k,Dec '16,questions
5302,Tragic ending = bad comic?,8,2.8k,Dec '16,questions
5303,Getting over the hump of your old work,389,1.0k,Dec '16,questions
5304,What kinds of career do you do besides comics?,35,1.4k,Nov '16,questions
5305,Losing Subscribers,978,1.4k,Nov '16,questions
5306,Posting public content on Patreon?,46,1.4k,Nov '16,questions
5307,GoComics! Your thoughts?,1.6k,376,Nov '16,questions
5308,What’s the best approach when launching your webcomic?,16,1.6k,Nov '16,questions
5309,Help with the thumbnail,1.7k,635,Nov '16,questions
5310,To compress or to not compress?,4,749,Nov '16,questions
5311,Advertising to Gain More Subscriber!,219,262,Nov '16,questions
5312,Do you have any good luck charms?,5,1.8k,Nov '16,questions
5313,Is this a big no-no?,520,1.4k,Nov '16,questions
5314,Notification Difference,14,423,Nov '16,questions
5315,Fellow Traditional Artists Anywhere?,509,758,Nov '16,questions
5316,Dragon Ball Fan Rewrite Project Poll,45,544,Nov '16,questions
5317,Why Can’t Our Comics have More than One Genre?,5.3k,1.6k,Nov '16,questions
5318,Should I outline my art work?,8,2.6k,Nov '16,questions
5319,¿How does top webcomics works?,344,942,Nov '16,questions
5320,Beginner - uploading to Tapastic?,28,4.2k,Nov '16,questions
5321,Social art sites?,775,824,Nov '16,questions
5322,I need help on a panel,9,617,Nov '16,questions
5323,Any ideas on how I can gain more subs,400,864,Nov '16,questions
5324,Pairing your comic with music,21,2.2k,Nov '16,questions
5325,Promoting and getting audience feedback,804,553,Nov '16,questions
5326,Trying to make long comic pages?,22,421,Nov '16,questions
5327,Webtoons image quality,845,5.3k,Nov '16,questions
5328,Who would you meet in person?,10,1.5k,Nov '16,questions
5329,Does it look bad to have several active comics?,436,1.3k,Nov '16,questions
5330,How do Invitation codes work?,6,2.6k,Nov '16,questions
5331,What are your opinons on my short sci-fi book so far?,320,503,Nov '16,questions
5332,Your first three months on Tapas!,7,1.5k,Nov '16,questions
5333,Should I mark this as mature content?,322,819,Nov '16,questions
5334,Resource Time! Where do they hide the bodies?,40,1.2k,Nov '16,questions
5335,Web comic or in a book store,1.8k,1.1k,Nov '16,questions
5336,Place to post your webcomics,48,1.3k,Nov '16,questions
5337,Making a Face When Drawing One,789,1.1k,Nov '16,questions
5338,What are you determined to be?,1,2.5k,Nov '16,questions
5339,How does webtoon define inappropriate content exactly?,241,2.5k,Nov '16,questions
5340,Anatomy Tips? I Need Help,7,2.0k,Nov '16,questions
5341,Should I worry about my story being too predictable,403,1.1k,Nov '16,questions
5342,¿Should i do a post on Tapas to promote my comic?,3,458,Nov '16,questions
5343,What the frak moment from tapas,820,1.1k,Nov '16,questions
5344,Weird sittuation involving old pages,10,507,Nov '16,questions
5345,Tapas is a commercial or non commercial website?,487,756,Nov '16,questions
5346,How many pages before uploading?,3,1.0k,Nov '16,questions
5347,¿What are the best days and hours to publish in webtoons?,312,880,Nov '16,questions
5348,Questions about about editing the story after it is published,16,681,Nov '16,questions
5349,Promotion under a page?,468,731,Nov '16,questions
5350,Professional Publishing? Taking the next step from webcomics,3,572,Nov '16,questions
5351,How’s school going?,262,2.6k,Nov '16,questions
5352,New to the WebComic Biz… Any tips?,5,774,Nov '16,questions
5353,What do your very first sketches look like?,399,2.3k,Nov '16,questions
5354,Comic Trailers?,4,1.6k,Nov '16,questions
5355,So … I’ve been learning how draw “dynamic” poses and here’s the result,312,671,Nov '16,questions
5356,Table discomfort,5,1.4k,Nov '16,questions
5357,¿What format size is recommended for webtoons and what other websites for webcomics exist?,334,1.7k,Nov '16,questions
5358,Is it possible to sell ad space on my tapas comic site?,26,597,Nov '16,questions
5359,Why is my pages come out so dull?,711,929,Nov '16,questions
5360,YCH Pricing Advice?,7,1.5k,Nov '16,questions
5361,How do ad displays translate to revenue?,355,324,Nov '16,questions
5362,Prolonged sitting.Its bad.(well..at least to me..),14,1.5k,Nov '16,questions
5363,How does everyone color their comics?,538,6.0k,Nov '16,questions
5364,Releasing my story,4,451,Nov '16,questions
5365,What are you tired of people asking you?,956,5.3k,Nov '16,questions
5366,Is this considered NSFW?,11,1.5k,Nov '16,questions
5367,Hello I need someone who speaks Arabic,460,471,Nov '16,questions
5368,To regularly updating folks - Do you have a buffer?,33,2.4k,Nov '16,questions
5369,It’s good to be bad (antiheroes),825,789,Nov '16,questions
5370,What draws you to look at someones novel or comic?,7,1.7k,Nov '16,questions
5371,Do you dislike in comic where( two equally powerful) men and women fight?,390,1.9k,Nov '16,questions
5372,What’re some of the darkest comics you’ve ever read?,6,1.3k,Nov '16,questions
5373,What puts you off a gag comic?,344,2.5k,Nov '16,questions
5374,Behind the Tablet!,5,1.7k,Nov '16,questions
5375,Facebook Page type: Book or something else?,2.1k,602,Nov '16,questions
5376,Tipping question for artist with more than one comic,4,652,Nov '16,questions
5377,Looking for Filipino Artists/Writers for My Thesis,200,280,Nov '16,questions
5378,Are there any other comic page like tapastic,1,672,Nov '16,questions
5379,Anyone draw more than they were planning?,202,1.2k,Nov '16,questions
5380,Why are you here?,1,3.1k,Nov '16,questions
5381,*How Do I Get More SUBSCRIBERS?!*,276,10.5k,Nov '16,questions
5382,Fun random Survey,6,2.9k,Nov '16,questions
5383,Looking for feedback on format (2×2 vs 1×4),333,636,Nov '16,questions
5384,How many hours do you work on your comic per day/week?,8,4.2k,Nov '16,questions
5385,"If you just start a new comic today, would you bother with tumblr?",442,2.8k,Nov '16,questions
5386,Does anyone know a premium comic that costs less than 200 coins?,3,622,Nov '16,questions
5387,Any advice would do,232,841,Nov '16,questions
5388,Sites for listing Conventions?,10,349,Nov '16,questions
5389,Any way to see past Daily Snacks?,625,416,Nov '16,questions
5390,Character limit per chapter in novel,3,1.1k,Nov '16,questions
5391,How did you fail?,284,708,Nov '16,questions
5392,How did you get successful?,29,2.1k,Nov '16,questions
5393,How many pages should I present to an artist for a potential collab?,1.2k,451,Nov '16,questions
5394,To fanservice or not to fanservice (in your own COMIC!),16,2.4k,Oct '16,questions
5395,Why do some people lose subs when they update?,1.5k,2.2k,Oct '16,questions
5396,Is it OK to post a completed comic?,33,799,Oct '16,questions
5397,How do you keep from getting tired?!,649,3.9k,Oct '16,questions
5398,Sequel: Do I create a new comic?,2,458,Oct '16,questions
5399,How do you get your tapas series shows up with Image & Summary on Twitter?,210,471,Oct '16,questions
5400,How do you stay positive?,20,2.0k,Oct '16,questions
5401,Did you struggle with updates at first?,845,1.2k,Oct '16,questions
5402,What do you plan to do when your story ends?,14,2.8k,Oct '16,questions
5403,Question for those who print their own comics and zines?,642,521,Oct '16,questions
5404,Advices to activate tips,21,799,Oct '16,questions
5405,Comic Search Help?,776,474,Oct '16,questions
5406,Would anyone be interested in 5-20pg horror comics?,10,563,Oct '16,questions
5407,Does anyone know of any good sites for out of copyright images / photos?,366,596,Oct '16,questions
5408,Know any good artist livestreams?,12,1.4k,Oct '16,questions
5409,The 3 ep rule? but for comics,427,2.0k,Oct '16,questions
5410,Why do you buy hard copies?,9,1.9k,Oct '16,questions
5411,Your experience with merch from Redbubble.com,371,2.0k,Oct '16,questions
5412,What is the WORST movie you’ve ever seen?,133,8.5k,Oct '16,questions
5413,Unique paneling in comics!,5.1k,3.0k,Oct '16,questions
5414,"There was a comic I was reading, and I can’t find it?",19,745,Oct '16,questions
5415,What’s your dream job?,606,3.1k,Oct '16,questions
5416,How do you make an emotional heart string pulling moment,8,1.4k,Oct '16,questions
5417,Posting on walls,375,496,Oct '16,questions
5418,"Rank what’s most important to you as a reader: Story, Character or Art?",50,3.2k,Oct '16,questions
5419,Would it be possible to juggle these two jobs?,1.7k,885,Oct '16,questions
5420,Rewarding your Tippers is Hard w/no tipper list on Desktop version!,0,1.4k,Oct '16,questions
5421,What’s your fave jam/playlist?,253,1.2k,Oct '16,questions
5422,Website for your comic?,25,955,Oct '16,questions
5423,Does the green flag on webtoon means that the comic is getting featured?,847,1.3k,Oct '16,questions
5424,A Question for Artist +Writer Teams,5,1.4k,Oct '16,questions
5425,Too much on your plate?,334,1.3k,Oct '16,questions
5426,Starting a animation production studio,7,721,Oct '16,questions
5427,Uhh losing lots of Subs?,362,2.2k,Oct '16,questions
5428,¿what are the best hours to post?¿which hours have more traffic?,14,982,Oct '16,questions
5429,People and Your Face,489,2.7k,Oct '16,questions
5430,Picarto question?,12,824,Oct '16,questions
5431,Any experienced Publisher who knows a trick or two?,348,1.6k,Oct '16,questions
5432,More then one platform?,4,571,Oct '16,questions
5433,Who’s your target audience?,306,2.8k,Oct '16,questions
5434,How do you handle readers’ expectations?,7,1.6k,Oct '16,questions
5435,Would my Comic be More Interesting/Enjoyable if it was in Color?,401,735,Oct '16,questions
5436,Does anyone what to join an art group?,14,422,Oct '16,questions
5437,Premium books and tipping,748,565,Oct '16,questions
5438,Uhhhh… What should I do?,43,585,Oct '16,questions
5439,Most outrageous/ silly/crazy comments you’ve gotten,1.6k,566,Oct '16,questions
5440,What makes you like a character?,17,1.4k,Oct '16,questions
5441,How do I spread the word about my serial novel?,1.2k,617,Oct '16,questions
5442,Trying to find an old comic,12,551,Oct '16,questions
5443,What page(s) in you’re comic would “You Say Run” go well with,530,853,Sep '16,questions
5444,Are Anthologies Allowed in the Novels Section?,3,444,Sep '16,questions
5445,Plushies for Comics: How?,315,750,Sep '16,questions
5446,What should I do with these comments?,3,473,Sep '16,questions
5447,Do I need to copyright my comic before making merch?,279,384,Sep '16,questions
5448,Do you ever make something you’re really proud of only to realize that something almost identical already exists?,39,1.6k,Sep '16,questions
5449,Can you earn tipable coins on the computer?,1.3k,521,Sep '16,questions
5450,Reference overload?,25,1.1k,Sep '16,questions
5451,How do you relax when making comics?,1.0k,2.5k,Sep '16,questions
5452,Dashboard Shares Count. What’s That All About,8,411,Sep '16,questions
5453,Best way to earn subscribers and reads?,377,1.0k,Sep '16,questions
5454,Sudden Quality Boost in Art because of one little thing,7,1.5k,Sep '16,questions
5455,Thanks again for the responses!,1.0k,1.7k,Sep '16,questions
5456,Seeking opinions / reviews on a comic / audience level,0,551,Sep '16,questions
5457,Do creators here at tapas also read? or too busy creating?,177,2.4k,Sep '16,questions
5458,Best day and hour?,4,364,Sep '16,questions
5459,Has the Discover x Patreon Pledge Program finished?,344,425,Sep '16,questions
5460,Whats your favorite cookies?,15,1.4k,Sep '16,questions
5461,What’s in common with the daily snacks?,6.9k,1.2k,Sep '16,questions
5462,Overly complex fantasy worlds - what are your thoughts?,0,1.0k,Sep '16,questions
5463,Fanmade content,233,1.5k,Sep '16,questions
5464,Anyone use the SoundCloud Feature?,6,515,Sep '16,questions
5465,How do you feel about selling merch for your comic?,393,1.9k,Sep '16,questions
5466,Would you like to become a character in my graphic novel?,1,389,Sep '16,questions
5467,¿How do you use the earned tipping coins in Tapas?,251,504,Sep '16,questions
5468,Ever had/have a sub that you kinda just want to go away?,4,1.0k,Sep '16,questions
5469,Work alone or on a team?,313,1.0k,Sep '16,questions
5470,Are there any realistic or manga style comics here on Tapastic?,24,3.3k,Sep '16,questions
5471,Why do some comics seem to skyrocket in subs from out of nowhere?,639,737,Sep '16,questions
5472,Should I make a Facebook page?,4,925,Sep '16,questions
5473,What should be the size of my comic?,253,349,Sep '16,questions
5474,Comics with multiple language situtations,7,856,Sep '16,questions
5475,Is there a way to buy tapas coins without a debitcard,449,373,Sep '16,questions
5476,Any of you ever managed to create a QR code for your comic?,8,1.0k,Sep '16,questions
5477,Have you read the Paperinik/Duck Avenger series?,532,471,Sep '16,questions
5478,Anyone use decentralized SNSs?,1,353,Sep '16,questions
5479,Your favorite writing drink?,728,1.6k,Sep '16,questions
5480,Artists going on holiday?,18,719,Sep '16,questions
5481,First Q&A I’ve done. What are your experiences?,576,829,Sep '16,questions
5482,Catharsis through creating,72,604,Sep '16,questions
5483,How long should I wait for a response from submission to tapas,2.0k,623,Sep '16,questions
5484,Best day to publish?,15,1.3k,Sep '16,questions
5485,How do you create your thumbnails?,451,532,Sep '16,questions
5486,Price to Unlock Episodes,9,2.3k,Sep '16,questions
5487,New Computer HELP!,2.8k,599,Sep '16,questions
5488,Automate Tapas links to social media,97,311,Sep '16,questions
5489,Looking for encouragement,1.4k,1.4k,Sep '16,questions
5490,Internet challenges,0,497,Sep '16,questions
5491,"I have tapas on adblock, and I have reasons",213,1.8k,Sep '16,questions
5492,How long have you been making comics?,5,2.4k,Sep '16,questions
5493,Everyone just wants to be remembered,391,1.0k,Sep '16,questions
5494,Dear Experienced Artists: I need advice!,0,563,Sep '16,questions
5495,Tablet pen issues in Clip Studio,209,370,Sep '16,questions
5496,What genre should I list my novels in?,6,375,Sep '16,questions
5497,"I have a friend who does audio,",350,313,Sep '16,questions
5498,Webcomic with animation chapters?,5,1.9k,Sep '16,questions
5499,Lets do a discord channel?,352,1.1k,Sep '16,questions
5500,How much has changed from six months ago for your art?,4,1.2k,Sep '16,questions
5501,Your preferred genre?,3.6k,1.6k,Sep '16,questions
5502,What are your favourite Patreon rewards?,2,1.4k,Sep '16,questions
5503,Sorry if this may sound ignorant. But,272,2.0k,Sep '16,questions
5504,Lookin’ For Facebook Page Advice,11,265,Sep '16,questions
5505,What genre is this song/Know any songs that sound like it?,498,564,Sep '16,questions
5506,Should I redraw my comic?,18,630,Sep '16,questions
5507,How to schedule pages without giving myself too much work?,1.0k,766,Sep '16,questions
5508,Change Society (Question in the post),2,1.7k,Sep '16,questions
5509,How you found your favorite webcomic,315,1.4k,Sep '16,questions
5510,"Dealing with reposters, stealing and etc",15,866,Sep '16,questions
5511,Can explicit penetration/sex scenes be self-censored to fit Tapas nsfw guidelines?,768,1.0k,Sep '16,questions
5512,What inspires/influences your comic? Share it!,83,1.6k,Sep '16,questions
5513,How to: Make a second comic profile icon,1.6k,691,Sep '16,questions
5514,Where do I start with printing my comic?,7,458,Sep '16,questions
5515,Clichés that You’re Okay with?,542,1.8k,Sep '16,questions
5516,What makes your art stand out?,5,2.0k,Sep '16,questions
5517,Premium comic lists?,582,398,Sep '16,questions
5518,How serious is too serious for tapas?,9,1.2k,Sep '16,questions
5519,What is your amateur passion?,430,1.6k,Sep '16,questions
5520,Why do you make comics/manga?,7,2.0k,Sep '16,questions
5521,Using Tumblr for Comics,677,979,Sep '16,questions
5522,Can’t remember a comic?,7,337,Sep '16,questions
5523,Characters Introduced Early or As The Story Goes On?,418,2.0k,Sep '16,questions
5524,When it’s all said and done “chapters”,23,490,Sep '16,questions
5525,¿How do you get tipped on Tapastic?,781,898,Sep '16,questions
5526,Can you use “personal use” fonts in an ad-revenue comic?,38,604,Sep '16,questions
5527,Question: How do I get Featured on the Front Page?,985,1.9k,Sep '16,questions
5528,You lose as much as you gains subs,17,870,Sep '16,questions
5529,How do you find new comic to read from Twitter?,699,493,Sep '16,questions
5530,Comics 2 Games?,40,1.1k,Sep '16,questions
5531,Tell Me About Your Comic!,1.1k,6.3k,Aug '16,questions
5532,Is webcomic work match with a busy professional life?,7,775,Aug '16,questions
5533,What makes you interested in reading a new webcomic?,315,1.4k,Aug '16,questions
5534,When to post front cover?,7,497,Aug '16,questions
5535,Q&As your thoughts?,553,515,Aug '16,questions
5536,Non-sexual Man Butt: NSFW?,90,1.6k,Aug '16,questions
5537,Long comic migracion how to start?,1.5k,719,Aug '16,questions
5538,Featuring other artists,1,597,Aug '16,questions
5539,What can I expect from Tapastic?,295,2.1k,Aug '16,questions
5540,What’s the best idea: Posting the prologue with a “coming soon” at the end or waiting til I have the first chapter and then start posting?,6,817,Aug '16,questions
5541,Can you help me? Something about copyright etc,621,418,Aug '16,questions
5542,Is there a Tapas Discord?,12,467,Aug '16,questions
5543,Meet ups in London?,447,391,Aug '16,questions
5544,A question to Tapastic Novel writers,3,1.5k,Aug '16,questions
5545,Lighthearted vs serious,315,2.2k,Aug '16,questions
5546,What do you do with the FanArts you receive?,20,2.1k,Aug '16,questions
5547,If someone paid you an isnane amount of money to make 50 pages per week,795,2.5k,Aug '16,questions
5548,How(and Where) to ask for Guest Art?,1,393,Aug '16,questions
5549,What Art Mediums do you use?,234,1.4k,Aug '16,questions
5550,"QUESTION, QUESTION, boku wa QUESTION",44,711,Aug '16,questions
5551,Creating novels through the comics section,1.0k,697,Aug '16,questions
5552,What is your favorite comic art style?,12,1.6k,Aug '16,questions
5553,Multiple creators on one series?,781,715,Aug '16,questions
5554,Is it okay to adjust/reupload some pages if your comic is new?,2,525,Aug '16,questions
5555,Vertical banners for cons,263,598,Aug '16,questions
5556,How to start comic series in Tapastic?,17,2.3k,Aug '16,questions
5557,Story or randomness?,473,712,Aug '16,questions
5558,¿Height and width recomended for a comic?,30,487,Aug '16,questions
5559,Do you Guys think That a post-apocalyptic / dark fantasy comic’s have a chance,695,682,Aug '16,questions
5560,Have you been featured before?,2,1.1k,Aug '16,questions
5561,“Thanks” posts- Nice or Nuisance?,1.0k,1.3k,Aug '16,questions
5562,Who here knows any awesome comedy manga and webcomics,8,1.7k,Aug '16,questions
5563,If you could voice any animated character who would it be?,313,659,Aug '16,questions
5564,How can a comic grow?,8,826,Aug '16,questions
5565,The longer the series the more difficult to get subscribers,567,1.7k,Aug '16,questions
5566,¿It is worth it adding a version in other language of my comic on tapasti?,13,565,Aug '16,questions
5567,Comic Book Layouts,470,2.6k,Aug '16,questions
5568,Are You A Fellow Horror Comic Artist?,21,1.7k,Aug '16,questions
5569,What is “NSFW” to you? (advice needed),717,1.3k,Aug '16,questions
5570,Anyone have a comic in its early stages?,8,7.6k,Aug '16,questions
5571,Patreon rewards ideas,519,1.2k,Aug '16,questions
5572,Would you hand over your webcomic to a publisher? Why or why not?,4,1.0k,Aug '16,questions
5573,Advice on short oneshot comics?,360,869,Aug '16,questions
5574,This thread for asking for word translations,19,276,Aug '16,questions
5575,To multi-page upload or not to multi-page upload that is the question,1.1k,554,Aug '16,questions
5576,Turning Fan Characters into Original Characters,5,1.1k,Aug '16,questions
5577,NYC SVA vs. MICA?,377,601,Aug '16,questions
5578,What’s wrong with san-serif font?,2,1.5k,Aug '16,questions
5579,Would you listen to a podcast that’s half music and half comics tips/interviews/advice?,285,604,Aug '16,questions
5580,Have you every hired a professional to help you with your comic?,2,399,Aug '16,questions
5581,"I just got tipping, what now?",339,370,Aug '16,questions
5582,Come on you artists! Focus!,16,2.0k,Aug '16,questions
5583,So is this the wrong place to talk about my water bill? or webtoons?,603,1.6k,Aug '16,questions
5584,How to go about printing comics - which services to pick?,4,1.5k,Aug '16,questions
5585,Tipping Age restiction,303,315,Aug '16,questions
5586,Understanding Page Views on Novel,25,542,Aug '16,questions
5587,If you could have merchandise made of your comic what type/company would you want,725,1.6k,Aug '16,questions
5588,HOW to spread my works?,21,1.2k,Aug '16,questions
5589,What comic has the most episodes?,718,551,Aug '16,questions
5590,Thoughts on Fire Alpaca?,14,904,Aug '16,questions
5591,Good pacing rate for web comics,472,525,Aug '16,questions
5592,What makes you happy?,24,1.7k,Aug '16,questions
5593,What genre should I pick for my novel?,983,236,Aug '16,questions
5594,Death and Tapas,84,403,Aug '16,questions
5595,Do people like daily updates or semi-daily with their webcomic reading?,3.4k,547,Aug '16,questions
5596,Advice re: Restarting my comic?,6,951,Aug '16,questions
5597,Who’s your favorite character in your comics?,360,1.8k,Aug '16,questions
5598,Did you ever lose inspirations for your comic?,150,1.2k,Aug '16,questions
5599,Videos about your comics?,20.3k,506,Aug '16,questions
5600,What to do when views increase after series “ended”?,24,880,Aug '16,questions
5601,What are schools like in really small rural towns?,1.2k,3.4k,Aug '16,questions
5602,What’s your Facebook / twitter fan page?,2,742,Aug '16,questions
5603,Is ART or STORY more important to you?,344,2.2k,Aug '16,questions
5604,What kind of nudity can be considered SFW,3,1.2k,Aug '16,questions
5605,Can I change keys back to coins?,277,401,Aug '16,questions
5606,The difference of hiveworks and tapastic?,1,2.5k,Aug '16,questions
5607,Just Want To Know If This Would Be Considered A Fanfic,247,372,Aug '16,questions
5608,Do I need ads on my comic to earn money?,8,1.1k,Aug '16,questions
5609,"Hey, first time using Tapas, and I have a question regarding my project",549,521,Aug '16,questions
5610,Can a left to right be perfectly mirrored for right to left with no issues?,20,637,Aug '16,questions
5611,Is any update scedule better than none at all?,738,925,Aug '16,questions
5612,How do you share your comic with that box arond the link,19,414,Aug '16,questions
5613,Anyone Seeing Success with the Novel Platform?,500,791,Aug '16,questions
5614,Spotlight banner,8,1.3k,Aug '16,questions
5615,Soundcloud legal question,1.4k,823,Aug '16,questions
