,titles,replies,views,activity,category
3497,Are There Any Good Girl’s Love Comics?,180,16.5k,Dec '18,questions
3498,What do you write on your comic’s Discord?,3,625,Dec '18,questions
3499,How to continue a story?,152,372,Dec '18,questions
3500,At what point do you quit? (novels),9,1.3k,Dec '18,questions
3501,Is the art decent enough for a reboot?,149,586,Dec '18,questions
3502,Free ink vs Support Ink?,2,298,Dec '18,questions
3503,Using T shirts to promote your comic,114,467,Dec '18,questions
3504,Tips for starting commissions,1,412,Dec '18,questions
3505,Tapas vs Wattpad?,89,2.9k,Dec '18,questions
3506,What to do with a Tapas work vs. Self-Pubbing with Amazon?,2,1.1k,Dec '18,questions
3507,How often you update your comic patreon rewards?,125,394,Dec '18,questions
3508,How Many Comic Challenges are there?,27,341,Dec '18,questions
3509,What are your favorite heart-warming manga/anime?,372,1.3k,Dec '18,questions
3510,Comic Format. Which one is the best?,7,615,Dec '18,questions
3511,What exactly does the “up” mean on Tapas?,141,734,Dec '18,questions
3512,Updating the Fresh Category–Change it for Comics Under 2000 Subs,2,1.9k,Dec '18,questions
3513,Expanding reach and Engaging fans on Line Webtoons discussion,148,665,Dec '18,questions
3514,CAPITAL LETTERS in bubbles,26,1.5k,Dec '18,questions
3515,No free ink ? INKSGIVING MAY 2019,660,957,Dec '18,questions
3516,Looking for some advice on this situation,21,680,Dec '18,questions
3517,Should My Character Gain Powers?,391,967,Dec '18,questions
3518,"World-building extra, is it bad?",13,1.0k,Dec '18,questions
3519,Potential New Tapas Feature? (Suggestion),267,1.0k,Dec '18,questions
3520,Another Design Lineup! Feedback Appreciated!,7,546,Dec '18,questions
3521,Sharing Art Account with IRL friends?,438,534,Dec '18,questions
3522,"Planning on Redoing My First Chapter, Should I Release All at Once?",0,257,Dec '18,questions
3523,When do you update?,137,1.5k,Dec '18,questions
3524,Settling ink goals?,37,338,Dec '18,questions
3525,Does anyone have any good resources for poses and reference photos?,765,2.9k,Dec '18,questions
3526,Should I post pages as separate chapters?,79,371,Dec '18,questions
3527,Traditional comic page vs vertical page,623,2.4k,Dec '18,questions
3528,Formatting (I think is what I’m looking for),17,725,Dec '18,questions
3529,Horizontal Scrolling view,868,667,Dec '18,questions
3530,How Do You Setup a Scroll/Webtoon Style Comic?,6,12.0k,Dec '18,questions
3531,Ideas for promoting your brand at conventions?,174,214,Dec '18,questions
3532,Is ad revenue and ink support helpful?,1,1.2k,Dec '18,questions
3533,Clip Studio Paint won’t open after it Crashes,135,1.8k,Dec '18,questions
3534,Is PayPal Safe to Use?,11,1.1k,Dec '18,questions
3535,What to do when your story gets to you? (Depression/Anxiety etc),176,453,Dec '18,questions
3536,How long should I practice art before working on my comic?,34,1.4k,Dec '18,questions
3537,How to Revive a Dead Story?,402,570,Dec '18,questions
3538,Does anyone have any good tutorials on drawing muscles? (Especially arm muscles),32,1.6k,Dec '18,questions
3539,What to do with tragedy,534,462,Dec '18,questions
3540,Tapas “”Landing Page”,28,511,Dec '18,questions
3541,Sub to unlock. It that a good idea?,326,786,Dec '18,questions
3542,What makes a good title for a webcomic?,11,774,Dec '18,questions
3543,What comic features likely don’t work in the scrolling format?,245,886,Dec '18,questions
3544,Call all creators! And (Only Readers),4,1.1k,Dec '18,questions
3545,Should I make my episodes shorter?,256,652,Dec '18,questions
3546,Summoning and manservant,38,666,Dec '18,questions
3547,Have not recieved tapas ink yet? (Answered),365,367,Dec '18,questions
3548,What’s the first anime series you ever saw in your life?,22,1.6k,Dec '18,questions
3549,Is anyone doing anything special for Inksgiving?,329,1.4k,Dec '18,questions
3550,GL Category? Am I the only one?!,12,2.0k,Dec '18,questions
3551,How important are the update notifications?,276,470,Dec '18,questions
3552,What would be the best way to notify mobile app users about updates,32,269,Dec '18,questions
3553,Music Making Apps For The Phone,15.6k,176,Dec '18,questions
3554,Environmental studies/color theory?,76,286,Dec '18,questions
3555,"(Unpaid) Finding an Artist for a partially completed manga story. After 4 months of work my team is almost done. Romance, Action, Slice of Life",695,326,Dec '18,questions
3556,Comic reading on Patreon,7,916,Dec '18,questions
3557,What’s the current policy on publishing fanworks?,285,546,Dec '18,questions
3558,Replying to comments on your comic?,7,2.2k,Dec '18,questions
3559,Is there any ‘official’ Youtube channels about comics?,168,244,Dec '18,questions
3560,Sketchy or Clean?,4,991,Nov '18,questions
3561,Advice for a New Reader - Need More Drugs!,240,528,Nov '18,questions
3562,NSFW Drawing for my BL Webcomic. Should or Should Not?,0,2.6k,Nov '18,questions
3563,Moments that made you happy for making a comic/novel?,99,1.0k,Nov '18,questions
3564,Caption for the drawing,5,378,Nov '18,questions
3565,How to promote webcomic? (Need Help),485,1.7k,Nov '18,questions
3566,Do you include character sheets in your comic?,3,1.1k,Nov '18,questions
3567,Anyone using Tapas in Kuwait?,142,450,Nov '18,questions
3568,Uploading Images using FireFox,13,291,Nov '18,questions
3569,Comic or graphical novel? What’s the difference?,240,1.2k,Nov '18,questions
3570,Is Facebook a good place to share your comics?,19,777,Nov '18,questions
3571,Questions or Raffle?,220,298,Nov '18,questions
3572,New here! Question about mythical comics,6,605,Nov '18,questions
3573,A Professional’s Guide To Life,339,1.0k,Nov '18,questions
3574,Would this be a tacky thing to do?,16,337,Nov '18,questions
3575,Relatable comics: yes? no? Your experience,403,755,Nov '18,questions
3576,How must ink will you support to the inksgiving?,5,430,Nov '18,questions
3577,How to set up a Safe Zone when on larger than print canvas?,613,313,Nov '18,questions
3578,What are your favorite Super Forms? (Not restricted to anime),1,2.1k,Nov '18,questions
3579,Publishing Algorithm,134,367,Nov '18,questions
3580,Starting Episode just a quote: scaring readers away? (Novel),3,337,Nov '18,questions
3581,Face/body paint,118,444,Nov '18,questions
3582,Tracing a photo of a castle that I took HALP,24,852,Nov '18,questions
3583,What do you think of chibis in drama comics?,211,460,Nov '18,questions
3584,What is everyone doing for their mother/parental guardian today?,5,556,Nov '18,questions
3585,"My panels line up with Live/Safe area margins, is that okay?",189,752,Nov '18,questions
3586,Tapas Scares Me (?),73,720,Nov '18,questions
3587,Stopping art thieves when selling comics..how?,533,532,Nov '18,questions
3588,To join or not to join DevianArt?,16,1.4k,Nov '18,questions
3589,Flood Day activities,264,584,Nov '18,questions
3590,The Inside Scoop on Daily Views,3,632,Nov '18,questions
3591,Struck by madness… decided to launch my webcomic… art advice needed,143,681,Nov '18,questions
3592,Webtoons popularity ranking,40,1.5k,Nov '18,questions
3593,Webtoons comment notifications help: Is it the website design or is it my own incompetence?,2.0k,2.3k,Nov '18,questions
3594,Writers Block Help,26,542,Nov '18,questions
3595,New episode and a question tapas.io,359,326,Nov '18,questions
3596,What’s your favorite movie of all time?,6,1.2k,Nov '18,questions
3597,What are the creator’s rights?,323,915,Nov '18,questions
3598,Unconventional Comics–Breaking the Mold,28,1.3k,Nov '18,questions
3599,Question about BL genre and reader expectations,323,1.5k,Nov '18,questions
3600,What’s your favorite OC(s)?,5,1.7k,Nov '18,questions
3601,How is Photoshop for drawing?,200,1.2k,Nov '18,questions
3602,How often do you really need to upload episodes on WEBTOON?,10,3.8k,Nov '18,questions
3603,Comics set in the past?,412,761,Nov '18,questions
3604,"I’m new to commission drawing. Can I run a poll asking, out of context, how much you’d pay for these? (Yes, another one of THOSE threads.)",8,421,Nov '18,questions
3605,"Title, Title I need a Title",133,597,Nov '18,questions
3606,Requesting Opinion on Commission Prices,5,663,Nov '18,questions
3607,Clip keeps deleting colour sets!,169,356,Nov '18,questions
3608,Promoting a comic that is still in development?,5,544,Nov '18,questions
3609,Favorite Characters in Webcomics?,172,943,Nov '18,questions
3610,Who’s Your Dream Collaborator?,55,999,Nov '18,questions
3611,SUBCRIBERS are growing up But VIEWS are STAGNANT. Why?,411,581,Nov '18,questions
3612,Did I pick the wrong genre for my webcomic?,3,410,Nov '18,questions
3613,Post my own comics,154,247,Nov '18,questions
3614,Taboo to call things failure,27,1.1k,Nov '18,questions
3615,From Tapas to Webtoons. Then what?,273,910,Nov '18,questions
3616,Need help finding a comic!,2,441,Nov '18,questions
3617,Discord Servers for Tapas?,382,358,Nov '18,questions
3618,Looking for this comic?,4,423,Nov '18,questions
3619,Line Webtoon messing with views?,174,447,Nov '18,questions
3620,Are you related to someone famous?,1,1.1k,Nov '18,questions
3621,Webtoon Stats Glitch?,147,573,Nov '18,questions
3622,How do you draw characters?,23,1.7k,Nov '18,questions
3623,What Is “Inksgiving” and how does one obtain it?,303,989,Nov '18,questions
3624,Hello There Stranger! How are you,19,788,Nov '18,questions
3625,Tapas why do you hate me,456,986,Nov '18,questions
3626,Webtoon stats acting up,0,716,Nov '18,questions
3627,What conventions is everyone going to?,129,2.5k,Nov '18,questions
3628,French Speakers? I don’t trust google translate,22,476,Nov '18,questions
3629,"Starting big, rather than starting small?",339,656,Nov '18,questions
3630,Book or Webcomic?,20,747,Nov '18,questions
3631,Updating Schedules?,469,872,Nov '18,questions
3632,Erotic BL webcomic. How far can I go before I cross the porn line?,9,3.1k,Nov '18,questions
3633,One Long Book vs. A Couple Shorter Books,332,363,Nov '18,questions
3634,How do yo feel about heavy amounts of dialogue in webcomics?,8,1.5k,Oct '18,questions
3635,How to Bypass Region lock in Android?,314,3.2k,Oct '18,questions
3636,Transitioning from one project to the next,9,394,Oct '18,questions
3637,Issue with the subscriber count,307,417,Oct '18,questions
3638,Reaching 25 Sub Goal. (Novel),11,719,Oct '18,questions
3639,Discord can someone explain it to me in layman’s terms please?!,324,555,Oct '18,questions
3640,Should I Restart my Comic?,24,528,Oct '18,questions
3641,I need art resources!,1.3k,428,Oct '18,questions
3642,Tapas Twitch - could be fun for us all?!,15,350,Oct '18,questions
3643,Monthly release..what do you think?,213,652,Oct '18,questions
3644,If you could go back in time and give advice to yourself,5,837,Oct '18,questions
3645,"Cinematic screencap type of webcomic, recommendation?",146,619,Oct '18,questions
3646,What are you struggling with right now?,10,2.7k,Oct '18,questions
3647,Motivated over art trick you’ve learned,2.6k,377,Oct '18,questions
3648,Reception of Satire?,78,460,Oct '18,questions
3649,Hello there i have a very important question,678,376,Oct '18,questions
3650,Does anyone have stories they’ve regretted making?,71,1.2k,Oct '18,questions
3651,What’s your fav page you’ve made so far?,602,1.3k,Oct '18,questions
3652,Advice for worries about never being successful as a creator/artist?,8,1.7k,Oct '18,questions
3653,And Who Speaks Esperanto?,191,288,Oct '18,questions
3654,A question of collaboration,13,266,Oct '18,questions
3655,Real Photos or Art Work?,256,402,Oct '18,questions
3656,Is it just me but in respect of Avengers Endgame WARNING SPOILERS of Avengers series but not Endgame itself,26,260,Oct '18,questions
3657,Do you ever just sit there and re-think you’re life choices?,421,584,Oct '18,questions
3658,"When You Chat With Forum People, Do You Think They Look Like Their Avatars?",20,1.1k,Oct '18,questions
3659,Killing off your comic. Bow out gracefully or go down screaming in flames,312,1.5k,Oct '18,questions
3660,When should I publish?,39,360,Oct '18,questions
3661,How Much Do You Use Social Media to Grow Your Subs?,487,527,Oct '18,questions
3662,Update or new ep,5,534,Oct '18,questions
3663,How does one find beta readers to read a comic script?,152,423,Oct '18,questions
3664,What’s wrong with Tapas followers?,3,2.3k,Oct '18,questions
3665,Can fanfiction be posted here?,289,677,Oct '18,questions
3666,What are your characters’ favorite and least favorite foods?,12,797,Oct '18,questions
3667,“Text-Dump” for Novels?,245,372,Oct '18,questions
3668,Your Fear as a Creator 2: Electric Boogaloo,42,1.3k,Oct '18,questions
3669,How often is too often?,735,418,Oct '18,questions
3670,What do think of Tapas as a service?,11,1.1k,Oct '18,questions
3671,What Cliches/Tropes Do You Enjoy?,190,1.0k,Oct '18,questions
3672,Question relating to webtoons,40,304,Oct '18,questions
3673,Do my views count? (Answered),873,420,Oct '18,questions
3674,How many pages/content should you have at launch?,3,717,Oct '18,questions
3675,"Chapters vs pages, Which way do you upload or perfer to read webcomics?",218,491,Oct '18,questions
3676,Can we talk about the Romance “fan-cult” in webcomics,4,1.4k,Oct '18,questions
3677,Taking advantage of layers in certain programs,204,385,Oct '18,questions
3678,Finding an old comic’s name?,10,275,Oct '18,questions
3679,Tapas + Webtoons =?,206,1.5k,Oct '18,questions
3680,Getting back into things after a injury-induced hiatus?,68,332,Oct '18,questions
3681,"How do you celebrate Easter? And when do you put up decorations, if you do?",3.9k,958,Oct '18,questions
3682,Questions about deleting chapters,28,445,Oct '18,questions
3683,Is TopWebComics active and worth buying ads on?,368,377,Oct '18,questions
3684,Are Tapas forum users and Tapas readers the same group of people?,38,733,Oct '18,questions
3685,“Popularity” Questionaire [CLOSED],537,1.2k,Oct '18,questions
3686,Goofy Things You Used to Believe,1,2.0k,Oct '18,questions
3687,Teeth Making Cronching Noises?,119,545,Oct '18,questions
3688,How does view count work?,6,704,Oct '18,questions
3689,What is the best time and day to post a comic on Tapas and Webtoons?,145,1.1k,Oct '18,questions
3690,How do you get over perfectionism on a project you’ve been working on for a while?,24,981,Oct '18,questions
3691,How do you guys construct your pages?,339,1.2k,Oct '18,questions
3692,"Is the webcomic audience dying, becoming more niche, or are we just in a recession?",4,1.7k,Oct '18,questions
3693,Webtoons flagging previously approved content?,168,1.4k,Oct '18,questions
3694,How Do I Make Friends On Here?,14,1.2k,Oct '18,questions
3695,To Meme or Not To Meme in Comics,213,1.7k,Oct '18,questions
3696,Does a webcomic need to have detailed art or shading to be successful?,10,996,Oct '18,questions
3697,What do you do in this case?,258,1.3k,Oct '18,questions
3698,What causes you to lose interest in a webcomic?,1,1.4k,Oct '18,questions
3699,Help me pick a name! [POLL OPEN],152,731,Oct '18,questions
3700,Alternatives to DoujinPress?,55,829,Oct '18,questions
3701,Poll: Are you more likely to support an artist/writer on Patreon or Kickstarter?,7.0k,243,Oct '18,questions
3702,SVA vs SCAD vs MICA vs CCA,120,927,Oct '18,questions
3703,Should I still make a Patreon?,5.0k,399,Oct '18,questions
3704,How to make glitchy font,65,2.3k,Oct '18,questions
3705,Death Note and Philosophy,8.7k,243,Oct '18,questions
3706,How do you feel about the rise in Korean names for OCs?,15,1.5k,Oct '18,questions
3707,"Upcoming Project, Doubt",1.1k,482,Oct '18,questions
3708,Does a comic need romance/smut to be interesting?,51,2.2k,Oct '18,questions
3709,How long did you take to earn $25 from ad revenue?,779,2.8k,Oct '18,questions
3710,Who would be your dream collab?,3,731,Oct '18,questions
3711,What are the best days and times to upload on webtoons,186,428,Oct '18,questions
3712,What does mature themes cover?,6,373,Oct '18,questions
3713,Should I reboot? Help needed!,199,745,Oct '18,questions
3714,Comic Turn Offs?,5,4.4k,Oct '18,questions
3715,Anybody Do Novel Covers? (Paid) CLOSED FOR NOW,208,538,Oct '18,questions
3716,Need to know if its ok,3,468,Oct '18,questions
3717,Another Ipad Question (Stylus),139,363,Oct '18,questions
3718,Who do you feel you don’t deserve (in a good way!),1,1.0k,Sep '18,questions
3719,How to build a shared universe in comics,137,755,Sep '18,questions
3720,Your content getting commented by an unexpected group of people?,0,657,Sep '18,questions
3721,How do two creators work on the same comic?,98,392,Sep '18,questions
3722,Helpful Hints for the New and Technology-Challenged,41,303,Sep '18,questions
3723,Thanking People For Subscribing,559,1.1k,Sep '18,questions
3724,Whose voice popped in your head?😁,5,524,Sep '18,questions
3725,How to deal with Analysis Paralysis?,212,580,Sep '18,questions
3726,Is Price Worth Noting?,46,436,Sep '18,questions
3727,What do you struggle with drawing the most? (in comics or in gen),348,1.2k,Sep '18,questions
3728,Are links in episode descriptions allowed?,20,353,Sep '18,questions
3729,Is Webtoon changing?,1.1k,3.4k,Sep '18,questions
3730,Good Apps for drawing?,0,578,Sep '18,questions
3731,What is considered NSFW? (Mainly on Patreon),147,1.4k,Sep '18,questions
3732,"MS Paint, versatile or not?",11,968,Sep '18,questions
3733,Portrait or Landscape? What is the limit here?,329,340,Sep '18,questions
3734,How Long Is Too Long For A Comedic Scene?,8,470,Sep '18,questions
3735,Free tapastic ink offers not working?,192,646,Sep '18,questions
3736,Webtoon contest 2018 update: Why are people not supporting the winners?,13,2.1k,Sep '18,questions
3737,Is there a way to clear out suggested topics?,272,405,Sep '18,questions
3738,"Popular’s first page nothing but premium, mistake? or “problem?”",5,693,Sep '18,questions
3739,Free tapas to day,187,343,Sep '18,questions
3740,"Question about tags, not the usual one I promise",4,480,Sep '18,questions
3741,Why does your comic exist?,2.6k,2.2k,Sep '18,questions
3742,How to make audio versions of prose stories interesting as a You Tube video?,61,229,Sep '18,questions
3743,Please give some pointers on a good story introduction,710,496,Sep '18,questions
3744,Thoughts on queerbaiting in comics?,17,1.7k,Sep '18,questions
3745,Pictures on a novel,273,275,Sep '18,questions
3746,Can anyone explain the disconnect between manga and webcomic readers,10,1.9k,Sep '18,questions
3747,Editing your whole series…… Is it possible?,182,391,Sep '18,questions
3748,A Comic Creator’s Interview,5,2.2k,Sep '18,questions
3749,Does this animatic work?,253,327,Sep '18,questions
3750,Holy cow 3k subs on Webtoon with a little more than a month,1,911,Sep '18,questions
3751,How to get noticed on Tapas,215,1.1k,Sep '18,questions
3752,What song played in your head? 😎,7,909,Sep '18,questions
3753,How is the forum influencing your comic/novel reading habits?,376,593,Sep '18,questions
3754,What is your favorite vocaloid songs?,44,518,Sep '18,questions
3755,Where should you promote your novels on reddit?,412,281,Sep '18,questions
3756,Having your own comic dubbed?,15,1.2k,Sep '18,questions
3757,Which of these 2 comics would you prefer reading?,320,734,Sep '18,questions
3758,How do you remain motivated to finish a comic?,19,568,Sep '18,questions
3759,The use of kabbalah in manga,488,1.8k,Sep '18,questions
3760,How to Stick with Your Schedule,41,1.1k,Sep '18,questions
3761,What is ink used for?,1.5k,357,Sep '18,questions
3762,What would it take you to vote for a comic?,5,580,Sep '18,questions
3763,Stupid Impulses,191,595,Sep '18,questions
3764,Does anyone participate in Free Comic Book Day?,7,513,Sep '18,questions
3765,What is a co-production and how does it work?,658,219,Sep '18,questions
3766,Does making LGBT content online affect your professional career as an artist?,0,1.3k,Sep '18,questions
3767,"Why do some comics on tapas open at the latest episode, and some open at the first?",105,260,Sep '18,questions
3768,Having reddit for your works,13,546,Sep '18,questions
3769,Black and white vs Colour on Webtoon?,229,1.7k,Sep '18,questions
3770,Hating your own work,74,1.0k,Sep '18,questions
3771,Your personal challenges on your comic?,904,1.3k,Sep '18,questions
3772,Two page spreads in CSP pro?,4,1.2k,Sep '18,questions
3773,A question about episode titles,303,720,Sep '18,questions
3774,Implicit sex scene - allowed?,9,679,Sep '18,questions
3775,Is this even worth being worried over?,298,1.5k,Sep '18,questions
3776,I want to build a site for all of my comics,46,684,Sep '18,questions
3777,A quick question I have about copyright and a project I’m working on,516,778,Sep '18,questions
3778,"Do you like people, in general? (+poll)",13,1.0k,Sep '18,questions
3779,Gaining subs and losing likes,153,494,Sep '18,questions
3780,How do blind people emote?,0,1.1k,Sep '18,questions
3781,Do some people still really dislike digital comics for being digital?,108,614,Sep '18,questions
3782,Role play /games category,6,1.0k,Sep '18,questions
3783,How many subs before a Patreon,209,649,Sep '18,questions
3784,What do you imagine the characters in the webcomics you read sound like?,31,1.4k,Sep '18,questions
3785,What are some good ways webcomic creators to make a lot of money?,494,1.8k,Sep '18,questions
3786,"Hey, I need help finding this Webtoon",11,584,Sep '18,questions
3787,Is this really a disorder?,198,2.0k,Sep '18,questions
3788,Random Poll #2305: How often do you need to eat?,42,773,Sep '18,questions
3789,How to raise your motivation?,474,767,Sep '18,questions
3790,SketchUp and Patreon Concerns,6,1.1k,Sep '18,questions
3791,What are those ‘phantom edits’?,190,506,Sep '18,questions
3792,Why do people always say BL is the most popular genre when it’s not?,5,4.9k,Sep '18,questions
3793,Would a Character Guide be useful?,160,447,Sep '18,questions
3794,Do you use the website or the app to find comics?,9,731,Sep '18,questions
3795,Am I promoting bad habits?,626,539,Sep '18,questions
3796,Why is Romance and BL only popular online but not in the mainstream?,21,2.8k,Sep '18,questions
3797,Webtoon banner - what’s up with the newcomers?,357,3.2k,Sep '18,questions
3798,Misery writes interesting stories,3,923,Sep '18,questions
3799,Cursing without putting the NSFW tag. and a side question,161,415,Sep '18,questions
3800,One of my episodes is missing? How do I reorder episodes,4,454,Aug '18,questions
3801,Is it wrong to link your comics in your own topic post?,133,375,Aug '18,questions
3802,Screen protector for a pen tablet?,10,3.6k,Aug '18,questions
3803,Coming up with a pen name,278,759,Aug '18,questions
3804,Promo Research - How Do You Find New Comics?,3,1.1k,Aug '18,questions
3805,"Webtoons, Smack Jeeves, Comic Fury, The Duck, What do you use?",216,1.2k,Aug '18,questions
3806,A survey on periods,13,664,Aug '18,questions
3807,Why does clicking on a new novel/comic bring me to the latest update instead of the first?,240,1.0k,Aug '18,questions
3808,What’s the most unusual place where you started drawing?,6,866,Aug '18,questions
3809,Stylus or touch screen,160,411,Aug '18,questions
3810,How to stop your views and likes from going down?,42,748,Aug '18,questions
3811,Which is the most popular category in webtoons?,3.8k,895,Aug '18,questions
3812,For be featured in webtoons should be the comic in color?,64,390,Aug '18,questions
3813,What happen when we update single page episodes?,564,564,Aug '18,questions
3814,Comic pacing? Too fast? Too slow?,21,1.3k,Aug '18,questions
3815,Searching for a comic,319,325,Aug '18,questions
3816,Is it still BL if your main character is actually Bi and not Gay?,4,1.3k,Aug '18,questions
3817,Is there a way to re-organize our series?,163,292,Aug '18,questions
3818,What are your favorite reader comments and questions?,9,782,Aug '18,questions
3819,When to move on? (comic related),209,716,Aug '18,questions
3820,Names or phrases you don’t like?,18,1.3k,Aug '18,questions
3821,What’s best day to upload a comic?,240,421,Aug '18,questions
3822,Should i Fix up the first chapter of my comic?,98,692,Aug '18,questions
3823,Why do people bully?,1.4k,1.2k,Aug '18,questions
3824,Wouldn’t it be easier if there was a more narrow genre filtering system?,12,313,Aug '18,questions
3825,Why is the BTS webcomic dropping?,189,679,Aug '18,questions
3826,Worried about Falling into a Rut?,9,586,Aug '18,questions
3827,Any suggestions for tapas or outside webcomics I should read?,376,1.4k,Aug '18,questions
3828,"Worst fear, snakes or spiders?",20,1.4k,Aug '18,questions
3829,Story Arcs/Seasons/Chapters? How do you write your comic?,240,4.1k,Aug '18,questions
3830,Free Advertising Alternatives?,9,771,Aug '18,questions
3831,What type of laugher are you?,532,1.4k,Aug '18,questions
3832,Getting very few subs on my Webtoon - How to promote my work?,10,1.7k,Aug '18,questions
3833,Sneaky Patreon Subscriber? what’s this all about,375,1.9k,Aug '18,questions
3834,Doing a Test: Is my story worth it to you?,8,321,Aug '18,questions
3835,Difference between Chapters and Episodes?,208,600,Aug '18,questions
3836,Moving from Webtoons to Tapastic is a good idea?,2,676,Aug '18,questions
3837,Small question to you all,221,1.0k,Aug '18,questions
3838,Disney and Disney and Disney!,2,1.5k,Aug '18,questions
3839,Do you like K-pop?,215,1.2k,Aug '18,questions
3840,How To Improve a Webtoon? (Criticize my webtoon),7,1.2k,Aug '18,questions
3841,Do you ever do giveaways?,176,622,Aug '18,questions
3842,1000 subs what next?,26,846,Aug '18,questions
3843,So I still can’t seem to grow my audience,394,2.5k,Aug '18,questions
3844,How to go about putting your series on an indefinite hiatus?,42,480,Aug '18,questions
3845,Make a link in Webtoons Creator comments?,391,1.0k,Aug '18,questions
